product_name,barcode,unit_price,categories,image_urls
Gliss tápláló olaj sampon 400 ml,9000100549837,1784.0,puszedli-301,https://imageproxy.wolt.com/assets/689bb5d387a8f04a4a7de160
Globus Light ketchup 460 g,8720182818669,1314.0,tapszerek-224,https://imageproxy.wolt.com/assets/69d83da2f17312ee6578f17c
Globus Light majonéz 441 g,8721201900969,1419.0,tapszerek-224,https://imageproxy.wolt.com/assets/69eb4da6cbbf5c0b40d4d5c9
Globus csemege ketchup 477 g,8721317741777,1314.0,tapszerek-224,https://imageproxy.wolt.com/assets/69c6c5d222b147f1899f26d0
Globus csemege ketchup 833 g,8721317739897,1839.0,tapszerek-224,https://imageproxy.wolt.com/assets/69c6c5d322b147f1899f26d1
Globus csípős ketchup 470 g,8711200405923,1314.0,tapszerek-224,https://imageproxy.wolt.com/assets/69d83da9f17312ee6578f181
Globus klasszikus ízű mustár 440 g,8593838918163,1484.0,tapszerek-224,https://imageproxy.wolt.com/assets/68d1444d96bcfcad1bd5d8c8
Globus klasszikus ízű mustár 720 g,8593838918125,1909.0,tapszerek-224,https://imageproxy.wolt.com/assets/68d145ab96bcfcad1bd5dbce
Globus könnyed majonéz 451 g,8720182635068,1154.0,tapszerek-224,https://imageproxy.wolt.com/assets/69eb4da8cbbf5c0b40d4d5ca
Globus majonéz 425 g,8720182727244,1419.0,tapszerek-224,https://imageproxy.wolt.com/assets/69d83dbaf17312ee6578f18b
Globus majonéz 735 g,8720182739100,1994.0,tapszerek-224,https://imageproxy.wolt.com/assets/69d83dbcf17312ee6578f18d
Globus mustár 500 g,8720182793980,1484.0,tapszerek-224,https://imageproxy.wolt.com/assets/69d83dadf17312ee6578f184
Globus olaszos ketchup 470 g,8720182821409,1314.0,tapszerek-224,https://imageproxy.wolt.com/assets/69f870206725d19251e21958
Glossy sütőzacskó 5db közepes,,440.0,glutenmentes-276,https://wolt-menu-images-cdn.wolt.com/menu-images/66544565d6a91b4d1392d750/b6096a36-cf6a-11f0-b4aa-a2b1ab269af4_540997006.png
Glossy sütőzacskó 8db kicsi,,440.0,glutenmentes-276,https://wolt-menu-images-cdn.wolt.com/menu-images/66544565d6a91b4d1392d750/b606a8d2-cf6a-11f0-87ed-62c32d2243f0_540996009.png
Goldfish sajtos kréker 80 g,5996253001213,639.0,feher-bor-190,https://imageproxy.wolt.com/assets/69eb4d95cbbf5c0b40d4d5b7
Goldfish szezámmagos kréker 80 g,5996253001237,639.0,feher-bor-190,https://imageproxy.wolt.com/assets/69eb4d94cbbf5c0b40d4d5b6
Good Milk sovány joghurtital 500 g,,649.0,cukorkak-drazsek-108,https://imageproxy.wolt.com/assets/6a045d645311d3f37cb350aa
"Grant's kevert skót whisky 40% 0,7 l",5010327200132,7745.0,pekaru-241,https://imageproxy.wolt.com/assets/689b779187a8f04a4a7d82b9
Gránátalma db,,1039.0,tejszin-tejszinhab-51,https://imageproxy.wolt.com/assets/6a083d6d8ff37dbed4064dd3
Gullón tejcsokoládéval bevont keksz édesítőszerrel 128 g,8410376070323,1444.0,gin-183,https://imageproxy.wolt.com/assets/689ba1b6f18c6aaa8030ccad;https://imageproxy.wolt.com/assets/689ba1b7f18c6aaa8030ccb2
Gyümölcs ízű nyalóka 8 g,85814844,109.0,vodka-182,https://imageproxy.wolt.com/assets/689ba2a39bbcfa1dc39bd725;https://imageproxy.wolt.com/assets/689ba2a49bbcfa1dc39bd72a
"Győri Korpovit ropogós, édes keksz teljes kiőrlésű gabonával 174 g",7622201136734,599.0,gin-183,https://imageproxy.wolt.com/assets/6970c76b7e37809df6dec44f
"Győri Korpovit ropogós, édes keksz teljes kiőrlésű gabonával és magokkal 174 g",7622201137526,599.0,gin-183,https://imageproxy.wolt.com/assets/6970c7747e37809df6dec466
Győri Negro Classic ánizs ízű töltött keménycukorka 140 g,8723400948254,734.0,vodka-182,https://imageproxy.wolt.com/assets/6a018e7d30a310d3192f26db;https://imageproxy.wolt.com/assets/6a018e7d30a310d3192f26da
Győri Negro Extra Erős menta-mentol ízű keménycukorka 140 g,8723400948292,734.0,vodka-182,https://imageproxy.wolt.com/assets/6a018e7b30a310d3192f26d7;https://imageproxy.wolt.com/assets/6a018e7b30a310d3192f26d6
Győri Negro méz ízű töltött keménycukorka 140 g,8723400948377,734.0,vodka-182,https://imageproxy.wolt.com/assets/6a018e7c30a310d3192f26d9;https://imageproxy.wolt.com/assets/6a018e7c30a310d3192f26d8
Győri Pilóta epres piskótatallér 147 g,5906747310806,704.0,egyeb-alkoholos-italok-koktelok-181,https://imageproxy.wolt.com/assets/6a158d30dcf1703d0d093352
Győri Pilóta kakaós krémmel töltött omlós keksz 180 g,7622210078988,934.0,gin-183,https://imageproxy.wolt.com/assets/6a156311a6cb6dd4b4b33156
Győri Pilóta meggyes piskótatallér 147 g,5906747310820,704.0,egyeb-alkoholos-italok-koktelok-181,https://imageproxy.wolt.com/assets/6a158d31dcf1703d0d093353
Győri Pilóta málnaízű piskótatallér 147 g,5906747310868,704.0,egyeb-alkoholos-italok-koktelok-181,https://imageproxy.wolt.com/assets/6a1ffd3f90ed05223e914d47
Győri Pilóta sárgabarackos piskótatallér 147 g,5906747310783,704.0,egyeb-alkoholos-italok-koktelok-181,https://imageproxy.wolt.com/assets/6a2283f16daab3e35af041e5
Győri Pilóta tripla kakaós krémmel töltött kakaós keksz 180 g,7622210078995,934.0,gin-183,https://imageproxy.wolt.com/assets/69d6982bf17312ee6578ef0b
Győri Pilóta vaníliás ízű karika 150 g,7622210079077,934.0,gin-183,https://imageproxy.wolt.com/assets/68fcc2fd918c7369d40efb2e
Győri Pilóta vaníliás ízű karika 300 g,7622210079008,1784.0,gin-183,https://imageproxy.wolt.com/assets/69147e1343a2bd3cfbf4611e
Győri Pilóta vaníliás ízű karika kakaós tejbevonómasszával 150 g,7622210079091,934.0,gin-183,https://imageproxy.wolt.com/assets/6a2283fb6daab3e35af041e7
"Győri Édes Csokidarabos omlós, mézes keksz csokoládédarabokkal 150 g",5998711304522,464.0,gin-183,https://imageproxy.wolt.com/assets/69147e1343a2bd3cfbf4611d
"Győri Édes Duplajó kakaós bevonómasszával talpán mártott, kakaós, omlós keksz 150 g",5998711304430,714.0,gin-183,https://imageproxy.wolt.com/assets/6a01aaaa30a310d3192f271a
"Győri Édes Duplajó kakaós bevonómasszával talpán mártott, omlós, mézes keksz 150 g",5998711304423,714.0,gin-183,https://imageproxy.wolt.com/assets/68fcc2fb918c7369d40efb2b
"Győri Édes Zabfalatok almás, zabpelyhes, omlós keksz 198 g",7622202237652,714.0,gin-183,https://imageproxy.wolt.com/assets/691f0a5406e04050fa7f59aa
"Győri Édes Zabfalatok almás, zabpelyhes, omlós keksz 44 g",7622202394485,240.0,gin-183,https://imageproxy.wolt.com/assets/691f0a4c06e04050fa7f5997
"Győri Édes Zabfalatok fahéjas, zabpelyhes, omlós keksz 188 g",7622202238024,714.0,gin-183,https://imageproxy.wolt.com/assets/691f0a5206e04050fa7f59a6
"Győri Édes Zabfalatok tejcsokoládéval talpán mártott, zabpelyhes, omlós keksz 215 g",7622202237744,714.0,gin-183,https://imageproxy.wolt.com/assets/691f0a5506e04050fa7f59ab
"Győri Édes Zabfalatok zabpelyhes, omlós keksz 188 g",7622202237829,419.0,gin-183,https://imageproxy.wolt.com/assets/691f0a4b06e04050fa7f5996
"Győri Édes kakaós, omlós keksz 150 g",7622201760267,419.0,gin-183,https://imageproxy.wolt.com/assets/69147e1d43a2bd3cfbf46136
"Győri Édes kókuszos, mézes, omlós keksz 150 g",7622201760243,419.0,gin-183,https://imageproxy.wolt.com/assets/69147e1d43a2bd3cfbf46135
"Győri Édes omlós, kakaós keksz teljes kiőrlésű búzaliszttel 150 g",7622201760205,419.0,gin-183,https://imageproxy.wolt.com/assets/6a0ef5c37263bae3427f8990
"Győri Édes omlós, mézes keksz 150 g",7622201760229,419.0,gin-183,https://imageproxy.wolt.com/assets/69bc3a19016902d4a7a17f97
"Győri Édes omlós, mézes keksz teljes kiőrlésű búzaliszttel 150 g",7622201760182,419.0,gin-183,https://imageproxy.wolt.com/assets/6a0ef5c27263bae3427f898f
Győri Édes pillanatok duett 220g,7622202314155,714.0,gin-183,https://imageproxy.wolt.com/assets/68dd1fa4e4991e9d3ee0b04b
Győri édes pillanatok teavarázs 160g,7622202317767,714.0,gin-183,https://imageproxy.wolt.com/assets/6970c7407e37809df6dec3f3
Gála alma lédig,,73.95,tejszin-tejszinhab-51,https://wolt-menu-images-cdn.wolt.com/menu-images/66544565d6a91b4d1392d750/25f871ce-cc33-11f0-aa98-aadcc74101ea_84960009.jpg
Gárdonyi Teaház gyümölcstea szeder ízesítéssel és mentával 20 filter 40 g,5997505330143,964.0,energiaital-142,https://imageproxy.wolt.com/assets/689b850b87a8f04a4a7d986a;https://imageproxy.wolt.com/assets/689b850c87a8f04a4a7d986d
Görögdinnye csíkos lédig,,1992.0,turo-cottage-cheese-53,https://imageproxy.wolt.com/assets/6a214acca78ccc1ab27f96fa
HELL Ice Coffee UHT étcsokoládé- és málnaízű zsírszegény laktózmentes ital 250 ml,5999571057986,434.0,keksz-109,https://imageproxy.wolt.com/assets/69c180028b41e83846b01d28;https://imageproxy.wolt.com/assets/69c180028b41e83846b01d27
Haas Quittin 3:1 zselésítőszer 25 g,5997255705642,309.0,etelszosz-martas-164,https://imageproxy.wolt.com/assets/689bb11df18c6aaa8030d387
Haas Quittin Cukor Stop zselésítő befőzőszer lekvár készítéséhez 25 g,5999543465368,364.0,levesek-tesztak-169,https://imageproxy.wolt.com/assets/689bb1189bbcfa1dc39bea1f
Haas Quittin bodzaszörp tartósító 20 g,5999543465382,194.0,pezsgo-gyongyozo-bor-173,https://imageproxy.wolt.com/assets/689bb11a87a8f04a4a7dd27b
Haas Quittin zselésítőszer baracklekvár készítéséhez 25 g,5999543464378,309.0,etelszosz-martas-164,https://imageproxy.wolt.com/assets/689bb11b87a8f04a4a7dd283
Haas Quittin zselésítőszer eperlekvár készítéséhez 25 g,5999543465115,309.0,etelszosz-martas-164,https://imageproxy.wolt.com/assets/689bb11e9bbcfa1dc39bea26;https://imageproxy.wolt.com/assets/689bb11f9bbcfa1dc39bea2c
Haas Quittin zselésítőszer eperlekvár készítéséhez 3 x 25 g,5999543465474,844.0,etelszosz-martas-164,https://imageproxy.wolt.com/assets/689bb1189bbcfa1dc39bea1d;https://imageproxy.wolt.com/assets/689bb1199bbcfa1dc39bea22
Haas Spicy angol pikáns erős mustár 200 g,90555138,889.0,gyumolcs-6,https://imageproxy.wolt.com/assets/689baa159bbcfa1dc39be1b1;https://imageproxy.wolt.com/assets/689baa159bbcfa1dc39be1b6
Haas Spicy bajor pikáns édes mustár 200 g,90444166,889.0,gyumolcs-6,https://imageproxy.wolt.com/assets/689baa1387a8f04a4a7dbf0d;https://imageproxy.wolt.com/assets/689baa1487a8f04a4a7dbf12
Haas Vital 300 mg C-vitamin + cink citromízű pezsgőtabletta cukorral és édesítőszerekkel 20 db 80 g,5999038505036,744.0,halkonzerv-huskonzerv-melegszendvicskrem-152,https://imageproxy.wolt.com/assets/667652abd8b6b903a55ff0ad
Haas Vital Kalcium + D + K vitamin narancsízű pezsgőtabletta cukorral és édesítőszerekkel 20 db 80 g,5999038505098,744.0,halkonzerv-huskonzerv-melegszendvicskrem-152,https://imageproxy.wolt.com/assets/667652ac1b708918eb6e716b
Haas Vital Magnézium+ B6 citromízű pezsgőtabletta cukorral és édesítőszerekkel 20 db 80 g,5999038505074,744.0,halkonzerv-huskonzerv-melegszendvicskrem-152,https://imageproxy.wolt.com/assets/667652aad88b3e741b73ca1d
Haas Vital Multivitamin narancsízű étrend-kiegészítő pezsgőtabletta 80 g,5997255703280,744.0,halkonzerv-huskonzerv-melegszendvicskrem-152,https://imageproxy.wolt.com/assets/689b81f69bbcfa1dc39bc2c8;https://imageproxy.wolt.com/assets/689b81f89bbcfa1dc39bc2cd
Haas Vital Vas+C+folsav+B6+B12 vérnarancsízű pezsgőtabletta cukorral és édesítőszerekkel 20 db 80 g,5999038505111,744.0,halkonzerv-huskonzerv-melegszendvicskrem-152,https://imageproxy.wolt.com/assets/667652aad8b6b903a55ff0ab
Hagymamix 750 g,5999536030566,999.0,hurka-es-kolbasz-64,https://imageproxy.wolt.com/assets/689b970af18c6aaa8030bb31
Hagymás paillasse 300 g,,724.0,mez-80,https://imageproxy.wolt.com/assets/69e32a3d2aa2e1eb09807a2d
Halls Energy VitaB6 colaízű töltetlen keménycukorka 32 g,57031712,284.0,vodka-182,https://imageproxy.wolt.com/assets/697c9d9f088b76a80bd4a306
Hamé Gril Party zöldfűszeres grill fűszerkeverék 25 g,8593837270699,259.0,instant-elelmiszerek-168,https://imageproxy.wolt.com/assets/689ba3fbf18c6aaa8030d064;https://imageproxy.wolt.com/assets/689ba3fcf18c6aaa8030d068
Hamé Grill Party fokhagymás grill fűszerkeverék 25 g,8593837270712,259.0,instant-elelmiszerek-168,https://imageproxy.wolt.com/assets/689ba3fbf18c6aaa8030d062;https://imageproxy.wolt.com/assets/689ba3fcf18c6aaa8030d067
Hamé Grill Party gyros fűszerkeverék 23 g,8593837272242,259.0,instant-elelmiszerek-168,https://imageproxy.wolt.com/assets/6989d3d1df12ec286094ac2f
Hamé Grill Party saslik grill fűszerkeverék 23 g,8593837270705,259.0,instant-elelmiszerek-168,https://imageproxy.wolt.com/assets/689ba3fbf18c6aaa8030d061;https://imageproxy.wolt.com/assets/689ba3fbf18c6aaa8030d066
Hamé Grill Party sültcsirke fűszerkeverék 25 g,8593837272266,259.0,instant-elelmiszerek-168,https://imageproxy.wolt.com/assets/69945ff9b437c988d58cef3c
Hamé Grill Party sültkrumpli fűszersó 25 g,8593837272273,259.0,salataontet-dresszing-166,https://imageproxy.wolt.com/assets/6989d3d3df12ec286094ac31
Hamé citromos tonhalas pástétom 100 g,8593837272594,690.0,marha-120,https://imageproxy.wolt.com/assets/696f75827e37809df6deb1aa
Hamé ketchupos tonhalas pástétom 100 g,8593837272587,690.0,marha-120,https://imageproxy.wolt.com/assets/696f75817e37809df6deb1a9
"Hankey Bannister whisky 40% 0,7 l",5999572431587,7609.0,pekaru-241,https://imageproxy.wolt.com/assets/689b9a5d9bbcfa1dc39bd343
Haribo Balla Stixx Sauer gyümölcsízű gumicukorka 175 g,4001686014585,1019.0,tequila-184,https://imageproxy.wolt.com/assets/69cd5d60882f03cf986b6662
Haribo Berries zselés cukordrazsé 100 g,4001686705315,584.0,vodka-182,https://imageproxy.wolt.com/assets/689b786d87a8f04a4a7d85c2
"Haribo Exotix savanyú, gyümölcsízű kandírozott gumicukorka 80 g",5996379347677,564.0,vodka-182,https://imageproxy.wolt.com/assets/692edbf5b18c5ba5c5c62324
"Haribo Pasta Basta savanyú, gyümölcs- és kólaízű kandírozott gumicukorka keverék 160 g",4001686009635,849.0,tequila-184,https://imageproxy.wolt.com/assets/69df7000ddef9b56faf9e761
Haribo Peaches gyümölcsízű kandírozott gumicukorka 80 g,5996379000381,564.0,vodka-182,https://imageproxy.wolt.com/assets/692edbf3b18c5ba5c5c62323
"Haribo Pico-Balla savanyú, gyümölcsízű kandírozott gumicukorka konfekt 160 g",4001686013960,849.0,tequila-184,https://imageproxy.wolt.com/assets/69a97802f115f4a3251e87fd
Haribo Primavera gyümölcsízű kandírozott habosított gumicukorka 100 g,9002975405157,574.0,vodka-182,https://imageproxy.wolt.com/assets/698f196e960776714feee112
Haribo Roulette gyümölcsízű gumicukorka 25 g,4001686372234,190.0,vodka-182,https://imageproxy.wolt.com/assets/69ce4cdc804cb482365a0fc8
"Hatozaki Blended japán whisky 40% 0,7 l",5999139000973,16954.0,pekaru-241,https://imageproxy.wolt.com/assets/689b95b89bbcfa1dc39bcc3c
"Head & Shoulders Citrus Fresh 2az1-ben Korpásodás Elleni Sampon és Balzsam, 400 ml Korpamentes haj",8006530305372,2624.0,puszedli-301,https://imageproxy.wolt.com/assets/698dc824a51adfa230b31c8d
Head & Shoulders Classic Clean 2az1-ben korpásodás elleni sampon 400ml. Friss tiszta Illat,8700216304917,2624.0,puszedli-301,https://imageproxy.wolt.com/assets/68d145a296bcfcad1bd5dbb4
Head & Shoulders Menthol Fresh 2in1 korpásodás elleni sampon 400ml. Frissítő mentolillat,8700216305419,2624.0,puszedli-301,https://imageproxy.wolt.com/assets/6964e26c59d3b0a0d441a325
Head & Shoulders Menthol Fresh sampon 400ml,5011321336094,2624.0,puszedli-301,https://imageproxy.wolt.com/assets/68bad880860edfeaf9637509
Heinz American Style füstölt szalonnaízű szósz 220 ml,5000157078858,1589.0,tapszerek-224,https://imageproxy.wolt.com/assets/689b7799f18c6aaa80309ae2
Heinz Mild mustár 240 g,50457403,1379.0,tapszerek-224,https://imageproxy.wolt.com/assets/689b7118f18c6aaa803090d5
"Heinz Zero ketchup, hozzáadott cukor és só nélkül, édesítőszerrel 425 g",8715700126234,1734.0,tapszerek-224,https://imageproxy.wolt.com/assets/689ba6529bbcfa1dc39bdb57
Heinz csípős ketchup cayenne borssal 460 g,87157321,1734.0,tapszerek-224,https://imageproxy.wolt.com/assets/66793c4bbfc2441871a68e6c
Heinz ketchup 700 g,8715700116983,2099.0,tapszerek-224,https://imageproxy.wolt.com/assets/689ba650f18c6aaa8030d283
Heinz ketchup 875 ml,8715700016504,2309.0,tapszerek-224,https://imageproxy.wolt.com/assets/66793c9e34063d58fe45fdb8
Heinz ketchuppal ízesített majonéz 425 g,5900783009908,1889.0,tapszerek-224,https://imageproxy.wolt.com/assets/689b7b5c9bbcfa1dc39bb71b
Heinz majonéz 70% zsírtartalommal 395 g,8715700422510,1889.0,tapszerek-224,https://imageproxy.wolt.com/assets/689ba65587a8f04a4a7db910
Heinz mustár 445 g,8715700110196,2014.0,tapszerek-224,https://imageproxy.wolt.com/assets/689ba64f87a8f04a4a7db909
Heinz paradicsom ketchup 460 g,8715700112664,1734.0,tapszerek-224,https://imageproxy.wolt.com/assets/689ba650f18c6aaa8030d281
Hellmann's Cheddar sajtos szósz 430 g,8721201959608,1909.0,tapszerek-224,https://imageproxy.wolt.com/assets/689bafb69bbcfa1dc39be896
Hellmann's Light Mayonnaise 430 ml,8714100848623,1574.0,tapszerek-224,https://imageproxy.wolt.com/assets/667940ea8353ae60784d4f39
Hellmann's Original majonéz 383 g,8720182088277,1574.0,tapszerek-224,https://imageproxy.wolt.com/assets/69d83d9df17312ee6578f178
Hellmann's Samba édes-chilis majonézes szósz 263 g,8721201954306,1260.0,tapszerek-224,https://imageproxy.wolt.com/assets/69c5120c3c71c6b1ec23d65f
Hellmann's Tasty majonéz 411 g,8721317715624,1574.0,tapszerek-224,https://imageproxy.wolt.com/assets/69d83dbaf17312ee6578f18c
Hellmann's fokhagymás-joghurtos-zöldfűszeres majonézes farm szósz 240 g,8721317791109,1260.0,tapszerek-224,https://imageproxy.wolt.com/assets/69e9fbe128419a6b3196caee
Hellmann's majonéz 404 g,8714100848234,1574.0,tapszerek-224,https://imageproxy.wolt.com/assets/69d83da7f17312ee6578f180
Hellmann's vegán majonéz 408 g,8721201906305,1994.0,tapszerek-224,https://imageproxy.wolt.com/assets/69d83db3f17312ee6578f187
Herbária Cserszömörcés szájvíz menthol ízű 250 ml,5997005301957,1524.0,napolyi-ostya-300,https://imageproxy.wolt.com/assets/690b4381f0e433b8a3b0b143
Herbária citrom ízű cserszömörcés szájvíz 250 ml,5997005301971,1524.0,napolyi-ostya-300,https://imageproxy.wolt.com/assets/691b163baf7ff67e6dc54472
"Hohes C Antioxidáns direkt préselt vegyes gyümölcslé céklalével és E-vitaminnal 0,75 l",9001400108632,2129.0,laktozmentes-termekek-59,https://imageproxy.wolt.com/assets/68c16f802c60b119670eed8b
Hohes C Classic Piros Multi multivitamin vegyes gyümölcslé sűrítményekből 1 l,5998815126754,1209.0,halkonzerv-huskonzerv-melegszendvicskrem-152,https://imageproxy.wolt.com/assets/69302dddfd831a492a8a7e11
"Hohes C direkt préselt narancs-mangó gyümölcslé acerola pürével 0,75 l",9001400108601,2129.0,laktozmentes-termekek-59,https://imageproxy.wolt.com/assets/689db621a680a456cb636b97
Házisweets citromízű szőlőcukor tabletta 80 g,5998221500117,259.0,vodka-182,https://imageproxy.wolt.com/assets/667946f436d8a70a94117946
Házisweets natúr szőlőcukor tabletta 80 g,5998221500100,259.0,vodka-182,https://imageproxy.wolt.com/assets/667947172f2a0839d4ca3c56
Idared alma 4 db,,557.0,tejszin-tejszinhab-51,https://imageproxy.wolt.com/assets/69ef4585547dd5f47626304a
Innopharm Iso Sport alma-sárgabarack ízű pezsgőtabletta izotóniás ital készítéséhez 20 db 90 g,5999884984405,974.0,halkonzerv-huskonzerv-melegszendvicskrem-152,https://imageproxy.wolt.com/assets/692d8a786980ec1e3ff6575e
Isana Hydro Booster hyaluronszérum 30 ml,4305615838311,1879.0,azsiai-tesztafelek-293,https://imageproxy.wolt.com/assets/689b73d4f18c6aaa803094f9;https://imageproxy.wolt.com/assets/689b73d6f18c6aaa803094fe
Isana olajmentes szemsmink-eltávolító 100 ml,4305615657271,524.0,azsiai-tesztafelek-293,https://imageproxy.wolt.com/assets/689b73d387a8f04a4a7d7c8d;https://imageproxy.wolt.com/assets/689b73d487a8f04a4a7d7c92
Isana professzionális hajbalzsam 200 ml,4305615624945,829.0,piskota-302,https://imageproxy.wolt.com/assets/689b73bf87a8f04a4a7d7c72;https://imageproxy.wolt.com/assets/689b73c087a8f04a4a7d7c76
JOJO eper- és vaníliaízű habcukorka 80 g,8593893738256,529.0,vodka-182,https://imageproxy.wolt.com/assets/69132c99e9eb908bf84ef7bf
"Jack Daniel's Tennessee whiskey 40% 0,05 l",5099873046296,1274.0,pekaru-241,https://imageproxy.wolt.com/assets/689b72ebf18c6aaa803093fa
"Jack Daniel's Tennessee whiskey 40% 0,7 l",5099873030189,10079.0,pekaru-241,https://imageproxy.wolt.com/assets/69b7e3337c28665a5e59205f
Jack Daniel's Tennessee whiskey 40% 1 l,5099873030196,14119.0,pekaru-241,https://imageproxy.wolt.com/assets/69c11dcb872dc935a0bd1e4c
"Jack Daniel's almás likőr Jack Daniel's Tennessee whiskeyvel 35% 0,7 l",5995757004010,11284.0,pekaru-241,https://imageproxy.wolt.com/assets/69c11dc9872dc935a0bd1e4a
"Jack Daniel's fahéjas likőr Tennessee whiskeyvel 35% 0,7 l",5099873030608,11284.0,pekaru-241,https://imageproxy.wolt.com/assets/69b7e32e7c28665a5e59205a
"Jack Daniel's mézes likőr Jack Daniel's Tennessee whiskeyvel 35% 0,7 l",5995757003938,11284.0,pekaru-241,https://imageproxy.wolt.com/assets/69b7e32f7c28665a5e59205b
Jacobs Krönung Signature szemes pörkölt kávé 1000 g,8711000539330,9029.0,asvanyviz-138,https://imageproxy.wolt.com/assets/69c1801a8b41e83846b01d3f
Jameson Irish whiskey 40% 700 ml,5998829901743,10549.0,pekaru-241,https://imageproxy.wolt.com/assets/689b8f09f18c6aaa8030b1af
Jameson Stout Edition whiskey 40% 700 ml,5998829901828,12649.0,pekaru-241,https://imageproxy.wolt.com/assets/689b8f0bf18c6aaa8030b1b7
"Jar Our 30 Minute Miracle Platinum Plus Mosogatókapszula, 31 db",8006530100977,5124.0,cukrasz-termekek-274,https://imageproxy.wolt.com/assets/692d8a856980ec1e3ff65772
"Jar Our 30 Minute Miracle Platinum Plus Mosogatókapszula, 82 db",8006530100960,8609.0,cukrasz-termekek-274,https://imageproxy.wolt.com/assets/692d8a8e6980ec1e3ff65782
"Jar Platinum Mosogatókapszula, Lemon, , 113 Mosogatókapszula",8006530122184,8609.0,cukrasz-termekek-274,https://imageproxy.wolt.com/assets/692449624da254f4fa1758a1
"Jar Platinum Plus Mosogatókapszula, Lemon, , 65 Mosogatókapszula",8006530121651,7139.0,cukrasz-termekek-274,https://imageproxy.wolt.com/assets/6924495a4da254f4fa175895
"Jim Beam Apple alma ízesítésű Bourbon whiskey alapú likőr 32,5% 0,7 l",5999139000638,9499.0,pekaru-241,https://imageproxy.wolt.com/assets/689b95b287a8f04a4a7daaed
"Jim Beam Black Cherry cseresznye ízesítésű bourbon whiskey alapú likőr 32,5% 0,7 l",5999139000737,9499.0,pekaru-241,https://imageproxy.wolt.com/assets/689b95b5f18c6aaa8030b96f
"Jim Beam Bourbon Whiskey & Cola alkoholos üdítőital 4,5% 330 ml",5999139000799,1414.0,pekaru-241,https://imageproxy.wolt.com/assets/689b95b787a8f04a4a7daaf5
"Jim Beam Bourbon whiskey 40% 0,2 l",5999139000751,4409.0,pekaru-241,https://imageproxy.wolt.com/assets/689b95b687a8f04a4a7daaf1
"Jim Beam Bourbon whiskey 40% 0,7 l",5999139000775,9499.0,pekaru-241,https://imageproxy.wolt.com/assets/689b95b687a8f04a4a7daaf2
"Jim Beam Honey méz ízesítésű Bourbon whiskey alapú likőr 32,5% 0,7 l",5999139000621,9499.0,pekaru-241,https://imageproxy.wolt.com/assets/689b95b287a8f04a4a7daaf0
"Joe Black Original Whisky 40% 0,7 l",5996558368738,5719.0,pekaru-241,https://imageproxy.wolt.com/assets/689b7fcc9bbcfa1dc39bbffd
"Johnnie Walker Red Label skót whisky 40% 0,5 l",5995099737034,7819.0,pekaru-241,https://imageproxy.wolt.com/assets/6a10392e4c3c50c92b479a04
"Johnnie Walker Red Label skót whisky 40% 0,7 l",5995099737041,8974.0,pekaru-241,https://imageproxy.wolt.com/assets/6a10392e4c3c50c92b479a05
Joya Kókuszital Kalciummal UHT 1 l,9020200017609,1039.0,gumicukor-110,https://imageproxy.wolt.com/assets/689ba9fc9bbcfa1dc39be184;https://imageproxy.wolt.com/assets/689ba9fd9bbcfa1dc39be189
Joya mandulaital kalciummal 0% cukor UHT 1 l,9020200032916,1039.0,gumicukor-110,https://imageproxy.wolt.com/assets/69f8c4701bfdc862c473a51f;https://imageproxy.wolt.com/assets/69f8c46f1bfdc862c473a51e
KIS-KUN Csípős torma 190 g,5997420102764,900.0,tapszerek-224,https://imageproxy.wolt.com/assets/689bb4e59bbcfa1dc39bed46
KOCH'S Asztali mustár 210 g,5997420104447,404.0,tapszerek-224,https://imageproxy.wolt.com/assets/68d1447b96bcfcad1bd5d8fd
KOCH'S Asztali torma 200 g,5997420110509,1165.0,tapszerek-224,https://imageproxy.wolt.com/assets/689bb4e087a8f04a4a7ddf01
KOCH'S Medvehagymás majonéz 310 g,5997420104249,1364.0,tapszerek-224,https://imageproxy.wolt.com/assets/68bad893860edfeaf9637546
KOCH'S Olívás majonéz 310 g,5997420104263,1364.0,tapszerek-224,https://imageproxy.wolt.com/assets/68bad893860edfeaf9637545
KOCH'S Tejszínes tormakrém 190 g,5997420113401,1260.0,tapszerek-224,https://imageproxy.wolt.com/assets/689bb4e187a8f04a4a7ddf05
KOCH'S Wasabis torma 140 g,5997420101538,1260.0,tapszerek-224,https://imageproxy.wolt.com/assets/69b20242649ecdda9f3fe159
KOCH'S Édes mustár 210 g,5997420104461,404.0,tapszerek-224,https://imageproxy.wolt.com/assets/68cbfbe896bcfcad1bd5c31b
Kaldeneker Lekvárosház hagymalekvár 312 ml,5999885665075,2649.0,gyermek-italok-147,https://imageproxy.wolt.com/assets/689b9cad9bbcfa1dc39bd5fc;https://imageproxy.wolt.com/assets/689b9cae9bbcfa1dc39bd601
Kalifa Diákcsemege aszalt gyümölcsök és magvak keveréke 200 g,5997956700175,1165.0,novenyi-termekek-58,https://imageproxy.wolt.com/assets/689b868ef18c6aaa8030a237
Kalifa héj nélküli tökmag 100 g,5997956701349,649.0,novenyi-termekek-58,https://imageproxy.wolt.com/assets/689b869887a8f04a4a7d9ba9
Karaván Grill Tallér natúr grillsajtkészítmény tejszínnel és tojásfehérjével 2 x 70 g (140 g),5998201449917,1069.0,friss-leveles-teszta-retesteszta-pizzateszta-93,https://wolt-menu-images-cdn.wolt.com/menu-images/66544565d6a91b4d1392d750/8b4b1144-cc33-11f0-8d06-8e67db3758a2_538857008.jpg
Karaván csípős paprikás füstölt vágható zsíros szeletelt ömlesztett sajt 125 g,5998201449559,934.0,teszta-92,https://imageproxy.wolt.com/assets/699c486a33fb99da5472fb15
Karaván sajtos párna,,280.0,kremek-81,https://imageproxy.wolt.com/assets/6a083d3466f38ef6cda60398
Kata vanília ízű habos szelet 5 db 200 g,5998060308448,1404.0,bio-83,https://imageproxy.wolt.com/assets/6679456682f2c87030b8bf1c
"Kellogg's reggeli gabonapehely karamellás ízű rizsből, teljes kiőrlésű zabból és kukoricából 350 g",5059319036373,2225.0,jegkremek-132,https://imageproxy.wolt.com/assets/69cba98aaed5c7d51f142973
