product_name,barcode,unit_price,categories,image_urls
"Maoam Kracher olvadó rágóbonbon-drazsé pezsgő porral töltve, részben kóla ízesítéssel 70 g",4001686536582,550.0,vodka-182,https://imageproxy.wolt.com/assets/689b6b4987a8f04a4a7d7473
Maoam Wild Red Berries olvadó rágóbonbon 5 x 22 g (110 g),4001686502082,584.0,vodka-182,https://imageproxy.wolt.com/assets/689b6c9cf18c6aaa803089f4
"Maretti paradicsom, olíva és oregánó ízesítésű pirított kétszersült karikák 70 g",3800205875109,564.0,feher-bor-190,https://imageproxy.wolt.com/assets/689b6c6ef18c6aaa8030894f
Maretti sült fokhagyma ízesítésű pirított kétszersült karikák 70 g,3800205870517,564.0,feher-bor-190,https://imageproxy.wolt.com/assets/696e245a37fecf84c67b95b2
Maroni hámozott gesztenye snack 80 g,5997289702600,614.0,izesitett-tejitalok-jegeskave-57,https://imageproxy.wolt.com/assets/689b823987a8f04a4a7d9256
Maroni hámozott sült gesztenye 100 g,5997289702075,689.0,szoszok-martasok-ontetek-162,https://imageproxy.wolt.com/assets/689b823a87a8f04a4a7d9258
Master Good Chicken Champion Nuggets gyorsfagyasztott formázott csirke mellhús 500 g,5996638012988,1559.0,gyumolcsbor-193,https://imageproxy.wolt.com/assets/69cba976aed5c7d51f14295b;https://imageproxy.wolt.com/assets/69cba976aed5c7d51f14295a
Master Good Grill Good Bufallo ízesítésű csirkeszárny 800 g,5995222007249,1784.0,daralthus-124,https://imageproxy.wolt.com/assets/6a0485fd0cc41890bd5d7d4b;https://imageproxy.wolt.com/assets/6a0485fd0cc41890bd5d7d4c
"Master Good Grill Good füstölt, főtt, hámozott zöldfűszeres grillkolbász 370 g",5995663974438,1679.0,baromfi-119,https://imageproxy.wolt.com/assets/69f30dfb126eb988a8930743;https://imageproxy.wolt.com/assets/69f30dfa126eb988a8930742
"Master Good Grill Good füstölt, főtt, hámozott, sajtos grillkolbász csirkehúsból 370 g",5995663974414,1679.0,baromfi-119,https://imageproxy.wolt.com/assets/69f30dfa126eb988a893073f;https://imageproxy.wolt.com/assets/69f30df9126eb988a893073e
Master Good Grill Good koreai grillkolbász 370 g,5995663974452,1679.0,baromfi-119,https://imageproxy.wolt.com/assets/69f30dfc126eb988a8930747;https://imageproxy.wolt.com/assets/69f30dfb126eb988a8930746
Master Good Grill Good tandori ízesítésű csirke combfilé 800 g,5995222007225,2729.0,daralthus-124,https://imageproxy.wolt.com/assets/6a102b1d4c3c50c92b479905;https://imageproxy.wolt.com/assets/6a102b1d4c3c50c92b479904
MaxSport Protein csokoládé ízű protein szelet kakaóbevonattal 50 g,8588009163701,694.0,gyumolcskonzerv-befott-151,https://imageproxy.wolt.com/assets/69c57479e24f4a9d75093bc2
MaxSport Protein eper ízű fehérjeszelet fehér bevonóval 50 g,8588009163688,694.0,gyumolcskonzerv-befott-151,https://imageproxy.wolt.com/assets/69c57469e24f4a9d75093bbc
"MaxSport Protein fehérjeszelet pisztáciával, kakaós bevonattal 50 g",8588010097828,694.0,gyumolcskonzerv-befott-151,https://imageproxy.wolt.com/assets/69c5747ae24f4a9d75093bc3
MaxSport Protein vaníliaízű fehérjeszelet fehér bevonóval 50 g,8588009163671,694.0,gyumolcskonzerv-befott-151,https://imageproxy.wolt.com/assets/69c57468e24f4a9d75093bbb
Mazsi ZERO Somlói galuska 200 g,5998362516442,895.0,sutesi-alapanyagok-96,https://imageproxy.wolt.com/assets/69663b1559d3b0a0d441ac7b;https://imageproxy.wolt.com/assets/69663b1559d3b0a0d441ac7c
"Mentos Discovery 14 Flavours vegyes gyümölcs ízű cukordrazsé 37,5 g",87368277,304.0,vodka-182,https://imageproxy.wolt.com/assets/689bb24cf18c6aaa8030d4e4;https://imageproxy.wolt.com/assets/689bb24df18c6aaa8030d4e9
Milka Cake & Choc Piskóta Tejcsokoládé Darabokkal és Csokoládés Töltelékkel 35 G,7622210268914,264.0,egyeb-alkoholos-italok-koktelok-181,https://imageproxy.wolt.com/assets/68dfc24bb16814eaa0e5a83c
Milka Cake & Choc piskóta tejcsokoládé darabokkal és csokoládés töltelékkel 5 x 35 g (175 g),7622300784751,1094.0,egyeb-alkoholos-italok-koktelok-181,https://imageproxy.wolt.com/assets/6929960b6980ec1e3ff64090
Milka Choco Mini Stars tejes krémmel töltött keksz tejcsokoládéval 185 g,7622300292522,1094.0,gin-183,https://imageproxy.wolt.com/assets/68fcc305918c7369d40efb3b
Milka Choco Wafer alpesi tejcsokoládéval bevont ostya kakaós töltelékkel 5 x 30 g (150 g),7622210818553,1094.0,gin-183,https://imageproxy.wolt.com/assets/6926f3116980ec1e3ff5d24b
Milka Cookies Sensations keksz alpesi tejcsokoládé darabokkal és tejcsokoládés töltelékkel 156 g,7622210998781,1094.0,gin-183,https://imageproxy.wolt.com/assets/69cd5d3d882f03cf986b6633
Milka közepén puha kakaós keksz alpesi tej felhasználásával készült tejcsokoládé darabokkal 156 g,7622210635785,1094.0,gin-183,https://imageproxy.wolt.com/assets/6970c7467e37809df6dec403
Milli High Protein barackos pite ízű krémtúró 150 g,5998200752414,564.0,ecet-olaj-citromle-97,https://imageproxy.wolt.com/assets/696a2f6a6a75fe7e17cfbd3e
Milli XXL vaníliás krémtúró 150 g,5998200750519,539.0,ecet-olaj-citromle-97,https://imageproxy.wolt.com/assets/689b896987a8f04a4a7d9fad
Milli málnás sajttorta ízű krémtúró 90 g,5998200752506,369.0,ecet-olaj-citromle-97,https://imageproxy.wolt.com/assets/696a2f696a75fe7e17cfbd3d
Mister Potato barbecue ízesítésű sós snack 160 g,9557062331142,864.0,rum-188,https://imageproxy.wolt.com/assets/6a0af33a7263bae3427f704f
Mister Potato tejfölös-hagymás ízesítésű sós snack 160 g,9557062331135,864.0,rum-188,https://imageproxy.wolt.com/assets/6a0af3397263bae3427f704e
Mizo Coffee Selection Matcha Latte UHT laktózmentes zsírszegény matchástej édesítőszerekkel 250 ml,5998200486340,434.0,keksz-109,https://imageproxy.wolt.com/assets/69fc487095a8304bb503fe6f
Mizo Túró Rudi mangós-maracujás túródesszert kakaós bevonattal 5 x 45 g (225 g),5998200486593,1295.0,buzadara-liszt-zsemlemorzsa-95,https://imageproxy.wolt.com/assets/69fc487295a8304bb503fe71
Mizo Túró Rudi natúr túródesszert tejcsokoládé bevonattal 5 x 2 x 15 g (150 g),5998200479687,974.0,buzadara-liszt-zsemlemorzsa-95,https://imageproxy.wolt.com/assets/689b88e2f18c6aaa8030a5c9
Mizo Túró Rudi vaníliás-kávés túródesszert tejcsokoládé bevonattal 5 x 45 g (225 g),5998200486128,1295.0,buzadara-liszt-zsemlemorzsa-95,https://imageproxy.wolt.com/assets/69663ae859d3b0a0d441abf3
Mizo zsírszegény mangó-ananász ízű tej édesítőszerekkel 450 ml,5998200486326,529.0,keksz-109,https://imageproxy.wolt.com/assets/6a018e7230a310d3192f26c5
Mogyi Dou mix pörkölt földimogyoró és mazsola 70 g,5997347540304,444.0,voros-bor-191,https://imageproxy.wolt.com/assets/689b82a487a8f04a4a7d934e
Mogyi Micro Pop mikrohullámú sütőben elkészíthető sajtízű pattogatni való kukorica 3 x 100 g (300 g),5997347556794,755.0,borok-189,https://imageproxy.wolt.com/assets/689b82c587a8f04a4a7d9394
Mogyi Micro Pop mikrohullámú sütőben elkészíthető vajízű pattogatni való kukorica 100 g,5997473544047,324.0,borok-189,https://imageproxy.wolt.com/assets/689b849f87a8f04a4a7d9787
Mogyi Micro Pop mikrohullámú sütőben elkészíthető vajízű pattogatni való kukorica 3 x 100 g (300 g),5997347556800,755.0,borok-189,https://imageproxy.wolt.com/assets/689b82c587a8f04a4a7d9396
"Mogyi Micro Pop sajtízű, mikrohullámú sütőben elkészíthető pattogatni való kukorica 100 g",5997473544030,324.0,borok-189,https://imageproxy.wolt.com/assets/689b849f87a8f04a4a7d9789
"Mogyi Micro Pop sós, mikrohullámú sütőben elkészíthető pattogatni való kukorica 100 g",5997473544023,324.0,borok-189,https://imageproxy.wolt.com/assets/689b849df18c6aaa8030a0d3
"Mogyi Micro Pop sós, mikrohullámú sütőben elkészíthető pattogatni való kukorica 3 x 100 g (300 g)",5997347556787,755.0,borok-189,https://imageproxy.wolt.com/assets/689b82c487a8f04a4a7d9392
Mogyi diákcsemege magvak és mazsola 70 g,5997347540298,635.0,voros-bor-191,https://imageproxy.wolt.com/assets/689b82a387a8f04a4a7d934c
Mogyi mandulabél 100 g,5997347555636,900.0,voros-bor-191,https://imageproxy.wolt.com/assets/689b82c2f18c6aaa80309f77
Mogyi natúr pattogatni való kukorica 200 g,5997347555766,384.0,novenyi-termekek-58,https://imageproxy.wolt.com/assets/689b82c587a8f04a4a7d9395
Mogyi pirított napraforgómag 200 g,5997347544173,699.0,voros-bor-191,https://imageproxy.wolt.com/assets/689b82c187a8f04a4a7d9390
Mogyi pirított napraforgómag 60 g,5997347555674,285.0,voros-bor-191,https://imageproxy.wolt.com/assets/689b82c3f18c6aaa80309f79
Mogyi pirított sózott héjas napraforgómag 60 g,5997347555568,285.0,voros-bor-191,https://imageproxy.wolt.com/assets/689b82c187a8f04a4a7d938f
Mogyi pirított sózott napraforgómag 200 g,5997347544166,699.0,voros-bor-191,https://imageproxy.wolt.com/assets/689b82bd87a8f04a4a7d9383
"Mogyi pirított, sózott tökmag 130 g",5997347540267,849.0,voros-bor-191,https://imageproxy.wolt.com/assets/689b82a487a8f04a4a7d9350
"Mogyi pirított, sózott tökmag 50 g",5997347555599,404.0,voros-bor-191,https://imageproxy.wolt.com/assets/689b82c2f18c6aaa80309f78
Mokate Chocolate Frappe keksz ízesítésű azonnal oldódó csokoládé italpor 104 g,5900649086845,684.0,izesitett-viz-139,https://imageproxy.wolt.com/assets/69f3463f9887418f98f6808a;https://imageproxy.wolt.com/assets/69f3463f9887418f98f68089
Mulino Bianco Cuor di Mela almadzsemmel töltött omlós keksz 250 g,8076809530286,1629.0,gin-183,https://imageproxy.wolt.com/assets/68d2936778dafc9acabd5408
Málna 125 g,,935.0,tejfol-52,https://wolt-menu-images-cdn.wolt.com/menu-images/66544565d6a91b4d1392d750/d0c1d9ce-9948-11f0-b151-3268915a0aa3_dekor_repro_00964__1_.jpg
Müller Kaffee Frappé zsírszegény kávés tejital 400 g,4025500297206,704.0,keksz-109,https://imageproxy.wolt.com/assets/69a18e733fdec26b2f315054;https://imageproxy.wolt.com/assets/69a18e733fdec26b2f315055
Müller Riso Tropicana eper ízű tejberizs desszert 175 g,42457022,434.0,ecet-olaj-citromle-97,https://imageproxy.wolt.com/assets/66768207d8b6b903a5600317
NESCAFÉ 3in1 Frappé azonnal oldódó kávéspecialitás 8 x 15 g (120 g),8445291183049,1209.0,izesitett-viz-139,https://imageproxy.wolt.com/assets/6a1eb9aaf4e9027a14c53046;https://imageproxy.wolt.com/assets/69e0c1771579fca701d38e3a
NESCAFÉ Dolce Gusto Café au Lait tejes kávékapszula 16 db/16 csésze 160 g,7613033174704,2519.0,100-os-gyumolcs-es-zoldseglevek-137,https://imageproxy.wolt.com/assets/6a1da05f4d397ca2e0f90f90;https://imageproxy.wolt.com/assets/69fe0ae9c229ef417992bd63
"NESCAFÉ Dolce Gusto Cappuccino tej- és kávékapszula cukorral 16 db 186,4 g",7613036306270,2519.0,100-os-gyumolcs-es-zoldseglevek-137,https://imageproxy.wolt.com/assets/69fe0aacc229ef417992bd02;https://imageproxy.wolt.com/assets/69fe0aacc229ef417992bd03
"NESCAFÉ Dolce Gusto Cortado Espresso Macchiato koffeinmentes kávékapszula 16 db/16 csésze 99,2 g",7613033494765,2519.0,100-os-gyumolcs-es-zoldseglevek-137,https://imageproxy.wolt.com/assets/69fe0aebc229ef417992bd66;https://imageproxy.wolt.com/assets/69fe0aebc229ef417992bd67
"NESCAFÉ Dolce Gusto Cortado Espresso Macchiato tejes kávékapszula 16 db 100,8 g",7613032827014,2519.0,100-os-gyumolcs-es-zoldseglevek-137,https://imageproxy.wolt.com/assets/6a1619d93ad065b846d8294b;https://imageproxy.wolt.com/assets/695fa3e417906cb1450ae9ca
"NESCAFÉ Dolce Gusto Doppio Espresso kávékapszula 16 x 8,5 g (136 g)",7613287591517,2519.0,100-os-gyumolcs-es-zoldseglevek-137,https://imageproxy.wolt.com/assets/69fe0a97c229ef417992bce0;https://imageproxy.wolt.com/assets/69fe0a97c229ef417992bce1
"NESCAFÉ Dolce Gusto Espresso Decaffeinated Ground Roasted Coffee 16 x 5,5 g (88 g)",8445290351845,2519.0,100-os-gyumolcs-es-zoldseglevek-137,https://imageproxy.wolt.com/assets/6679487a7a690b684afa429f
"NESCAFÉ Dolce Gusto Espresso Intenso koffeinmentes kávékapszula 16 db/16 csésze 99,2 g",8445290352194,2519.0,100-os-gyumolcs-es-zoldseglevek-137,https://imageproxy.wolt.com/assets/69fe0aa3c229ef417992bcf5;https://imageproxy.wolt.com/assets/69fe0aa4c229ef417992bcf6
"NESCAFÉ Dolce Gusto Espresso Milano kávékapszula 16db/ 16 csésze 99,2 g",8445290422149,2519.0,100-os-gyumolcs-es-zoldseglevek-137,https://imageproxy.wolt.com/assets/69fe0a95c229ef417992bcde;https://imageproxy.wolt.com/assets/69fe0a96c229ef417992bcdf
NESCAFÉ Dolce Gusto Espresso Palermo kávékapszula 16 db/ 16 csésze 112 g,8445290422200,2519.0,100-os-gyumolcs-es-zoldseglevek-137,https://imageproxy.wolt.com/assets/69fe0a9ac229ef417992bce4;https://imageproxy.wolt.com/assets/69fe0a9ac229ef417992bce5
"NESCAFÉ Dolce Gusto Espresso Roma kávékapszula 16 db/ 16 csésze 99,2 g",8445290422163,2519.0,100-os-gyumolcs-es-zoldseglevek-137,https://imageproxy.wolt.com/assets/69fe0a95c229ef417992bcdd;https://imageproxy.wolt.com/assets/69fe0a94c229ef417992bcdc
NESCAFÉ Dolce Gusto KitKat ízesített italpor tejporral és kakaóporral 16 db 256 g,8445291756649,2519.0,gyumolcslevek-144,https://imageproxy.wolt.com/assets/6942a2b4971a9b8089960b3d
"NESCAFÉ Dolce Gusto Latte Macchiato kávékapszula 16 db 183,2 g",7613037491159,2519.0,100-os-gyumolcs-es-zoldseglevek-137,https://imageproxy.wolt.com/assets/6995b15f1e3577e719b528a1;https://imageproxy.wolt.com/assets/6995b15f1e3577e719b528a2
"NESCAFÉ Dolce Gusto Ristretto Ardenza kávékapszula 16 x 6,5 g (104 g)",8445290870537,2519.0,100-os-gyumolcs-es-zoldseglevek-137,https://imageproxy.wolt.com/assets/69fe0aaec229ef417992bd07;https://imageproxy.wolt.com/assets/69fe0aaec229ef417992bd06
NESCAFÉ Dolce Gusto Ristretto Barista kávékapszula 16 db/ 16 csésze 104 g,8445290869531,2519.0,100-os-gyumolcs-es-zoldseglevek-137,https://imageproxy.wolt.com/assets/69fe0aecc229ef417992bd6a;https://imageproxy.wolt.com/assets/69fe0aecc229ef417992bd6b
NESCAFÉ karamell ízű azonnal oldódó kávé 95 g,8445291343023,2099.0,izesitett-viz-139,https://imageproxy.wolt.com/assets/69e6be25609eafedc63ffc43
"NIVEA Anti Wrinkle 65+ ránctalanító, feltöltő nappali arckrém 50 ml",9005800311234,3529.0,levesbetet-292,https://imageproxy.wolt.com/assets/697b53b7088b76a80bd49b31;https://imageproxy.wolt.com/assets/697b53b6088b76a80bd49b2f
NIVEA Soft krém 300 ml,4005808751426,2309.0,levesbetet-292,https://imageproxy.wolt.com/assets/697b53df088b76a80bd49c00;https://imageproxy.wolt.com/assets/697b53df088b76a80bd49c01
Nagyi titka pizzaliszt 00 típus 1 kg,5998400563223,489.0,enjoy-termekek-160,https://imageproxy.wolt.com/assets/68e3b6c0b74a10b788fc1ba4
Nagyi titka teljes kiőrlésű pizzaliszt 1 kg,5998400563421,489.0,enjoy-termekek-160,https://imageproxy.wolt.com/assets/6929964f6980ec1e3ff64127
Narancssárga koktélparadicsom 250 g,,608.0,csemegepult-61,https://imageproxy.wolt.com/assets/6a02da0c23b81c3b263a3970
Naturella X Normal Camomile Tisztasági Betét44,8006540100769,1259.0,dobozos-gyumolcsle-306,https://imageproxy.wolt.com/assets/692edc50b18c5ba5c5c623d5;https://imageproxy.wolt.com/assets/692edc50b18c5ba5c5c623d6
Naturfood BIO héjnélküli tökmag 100 g,5997664301312,829.0,novenyi-termekek-58,https://imageproxy.wolt.com/assets/689b85d487a8f04a4a7d9a19
"Naturfood Diákcsemege mazsola, pörkölt földimogyoró és diófélék keveréke 200 g",5997664300605,1324.0,novenyi-termekek-58,https://imageproxy.wolt.com/assets/689b85cff18c6aaa8030a1ab
"Naturfood Gourmix aszalt, kandírozott gyümölcsök és diófélék 100 g",5997664310222,794.0,novenyi-termekek-58,https://imageproxy.wolt.com/assets/678e0e234b2b7137a212e3c2
Naturfood Magmix diófélék keveréke 100 g,5997664300353,1165.0,novenyi-termekek-58,https://imageproxy.wolt.com/assets/689b85cff18c6aaa8030a1ac
"Naturfood aszalt, édesített vörös áfonya 100 g",5997664300087,614.0,izesitett-tejitalok-jegeskave-57,https://imageproxy.wolt.com/assets/689b85ce87a8f04a4a7d9a0f
Naturfood hántolt napraforgó 200 g,5997664300094,529.0,novenyi-termekek-58,https://imageproxy.wolt.com/assets/689b85ce87a8f04a4a7d9a11
Naturfood héjnélküli tökmag 100 g,5997664301305,635.0,novenyi-termekek-58,https://imageproxy.wolt.com/assets/689b85d487a8f04a4a7d9a17
Naturfood kesudió 80 g,5997664301534,954.0,novenyi-termekek-58,https://imageproxy.wolt.com/assets/689b85d6f18c6aaa8030a1b1
Naturfood pekándió 100 g,5997664301732,1695.0,novenyi-termekek-58,https://imageproxy.wolt.com/assets/689b85d787a8f04a4a7d9a1e
Naturland csalánlevél gyógynövénytea 20 filter 30 g,5998794305355,919.0,icetea-143,https://imageproxy.wolt.com/assets/69205bbd06e04050fa7f5ea8;https://imageproxy.wolt.com/assets/69205bbd06e04050fa7f5ea9
Nektarin 500 g,,834.0,joghurtitalok-56,https://imageproxy.wolt.com/assets/6a2163983496700bf22e4c28
"Nerds szőlős-epres cukorka 46,7 g",1230000131780,1009.0,vodka-182,https://imageproxy.wolt.com/assets/68f77d8f991b63c9b819116f;https://imageproxy.wolt.com/assets/68f77d8f991b63c9b819116e
"Nescafé Dolce Gusto Espresso Intenso kávékapszula, 112 g, 16 db",7613036867436,2519.0,100-os-gyumolcs-es-zoldseglevek-137,https://imageproxy.wolt.com/assets/69fe0aacc229ef417992bd04;https://imageproxy.wolt.com/assets/69fe0aadc229ef417992bd05
"Nescafé Dolce Gusto Latte Macchiato Caramel tej- és kávékapszula (8 csésze), 16 db",7613037788884,2519.0,100-os-gyumolcs-es-zoldseglevek-137,https://imageproxy.wolt.com/assets/6a1e9d89f4e9027a14c52ed0;https://imageproxy.wolt.com/assets/6a1e9d89f4e9027a14c52ed1
Nescafé Iced azonnal oldódó kávé 95 g,8445292226387,2099.0,izesitett-viz-139,https://imageproxy.wolt.com/assets/6a1eb9a9f4e9027a14c53045
Nesquik Vanilla Milk Mix vaníliás ízű ízesítő italpor 350 g,8445291634381,2414.0,gyumolcslevek-144,https://imageproxy.wolt.com/assets/69ba85d22317c5280bd24a28
"Nesquik eperízű, ropogós gabonapehely vitaminokkal és vassal 330 g",5900020049308,1909.0,jegkremek-132,https://imageproxy.wolt.com/assets/69b451169ec6a96a3e98a802;https://imageproxy.wolt.com/assets/69b451169ec6a96a3e98a803
"Nesquik kakaós ízű, ropogós gabonapehely vitaminokkal és ásványi anyagokkal 225 g",5900020016065,1379.0,jegkremek-132,https://imageproxy.wolt.com/assets/69fb75959c4fe0d3ac5037a2;https://imageproxy.wolt.com/assets/69fb75959c4fe0d3ac5037a1
Neutrogena Norvég Formula gyorsan beszívódó kézkrém 75 ml,3574660412277,1574.0,levesbetet-292,https://imageproxy.wolt.com/assets/689bb2da87a8f04a4a7dd841
"Nikka Days japán whisky 40% 0,7 l",5999572430078,14529.0,pekaru-241,https://imageproxy.wolt.com/assets/689b9a5a9bbcfa1dc39bd33d
"Nissin Cup Noodles fűszeres instant tésztaleves, marha ízesítéssel ázsiai módra 64 g",5997523315412,635.0,kezmuves-sor-230,https://imageproxy.wolt.com/assets/689b8523f18c6aaa8030a134;https://imageproxy.wolt.com/assets/689b8525f18c6aaa8030a139
Nissin Cup Noodles instant tésztaleves csípős fűszeres ízesítéssel ázsiai módra 66 g,5997523315474,635.0,kezmuves-sor-230,https://imageproxy.wolt.com/assets/689b8523f18c6aaa8030a135;https://imageproxy.wolt.com/assets/689b8525f18c6aaa8030a13b
"Nissin Cup Noodles instant tésztaleves, csirke ízesítéssel ázsiai módra 63 g",5997523315009,635.0,kezmuves-sor-230,https://imageproxy.wolt.com/assets/689b852087a8f04a4a7d98ad;https://imageproxy.wolt.com/assets/689b852187a8f04a4a7d98b2
Nissin Smack csirke ízű instant tésztaleves 100 g,5997523300012,424.0,kezmuves-sor-230,https://imageproxy.wolt.com/assets/689b851c87a8f04a4a7d98a1;https://imageproxy.wolt.com/assets/689b851d87a8f04a4a7d98a7
Nissin Smack csípős csirke ízű instant tésztaleves 100 g,5997523302498,424.0,kezmuves-sor-230,https://wolt-menu-images-cdn.wolt.com/menu-images/66544565d6a91b4d1392d750/4c6c30f0-f37d-11ef-a058-22425533f88c_wst__prefix_____smack_csi_po_s__1_.jpg
Nissin Smack csípős marha ízű instant tésztaleves 100 g,5997523300036,424.0,kezmuves-sor-230,https://imageproxy.wolt.com/assets/689b851c87a8f04a4a7d98a2;https://imageproxy.wolt.com/assets/689b851d87a8f04a4a7d98a6
"Nissin Soba Wok Style instant tészta búzalisztből chili ízesítő szósszal, 111 g",5997523328092,599.0,kezmuves-sor-230,https://imageproxy.wolt.com/assets/689b852687a8f04a4a7d98b4
"Nissin Soba Wok Style instant tészta búzalisztből yakisoba ízesítő szósszal, 109 g",5997523328078,599.0,kezmuves-sor-230,https://imageproxy.wolt.com/assets/689b852687a8f04a4a7d98b5
No-No fahéjas keksz 150 g,5997427314368,649.0,gin-183,https://imageproxy.wolt.com/assets/689bb52f9bbcfa1dc39beda1
Nobilis szárított Golden almaszirom 20 g,,424.0,izesitett-tejitalok-jegeskave-57,https://imageproxy.wolt.com/assets/6a1691863d5c5adb75dc0efe
Nobilis szárított Jonatán almaszirom 20 g,5997690707898,424.0,izesitett-tejitalok-jegeskave-57,https://imageproxy.wolt.com/assets/6786546f9152b95bf686d6c0;https://imageproxy.wolt.com/assets/678654709152b95bf686d6c5
Nutella Biscuit kakaós mogyorókrémmel töltött keksz 193 g,8000500390306,1679.0,gin-183,https://imageproxy.wolt.com/assets/689b9f38f18c6aaa8030c875
"Nutella Biscuit kakaós mogyorókrémmel töltött keksz 41,4 g",8000500359358,419.0,gin-183,https://imageproxy.wolt.com/assets/689b9f32f18c6aaa8030c86b
"Nutriversum Flow eper ízesítésű, kollagén-, glicin-, L-arginin, cink ital édesítőszerekkel 500 ml",5999107125493,6254.0,halkonzerv-huskonzerv-melegszendvicskrem-152,https://imageproxy.wolt.com/assets/6932d077fb724c46d5246f84
Nutriversum Women hidrolizált marhakollagén- és cinktartalmú étrend-kiegészítő kapszula 100 db 67 g,5999107125769,4239.0,halkonzerv-huskonzerv-melegszendvicskrem-152,https://imageproxy.wolt.com/assets/689b94ad87a8f04a4a7da931
Nádudvari Chef Exclusive chilis sertés grillkolbász 300 g,5998202962071,999.0,baromfi-119,https://imageproxy.wolt.com/assets/689b89fb87a8f04a4a7da00a
Nádudvari Chef Exclusive ementáli sajtos sertés grillkolbász 300 g,5998202962095,999.0,baromfi-119,https://imageproxy.wolt.com/assets/689b89fb87a8f04a4a7da00c
Nádudvari fokhagymás sertés grillkolbász 300 g,5998202962187,999.0,baromfi-119,https://imageproxy.wolt.com/assets/689b89fb87a8f04a4a7da00d
Nádudvari grillkolbász mix 900 g,5998202963122,2899.0,baromfi-119,https://imageproxy.wolt.com/assets/689b8a03f18c6aaa8030a77f
"OREO Golden Vaníliaízű Töltött Keksz, vegetáriánusok is fogyaszthatják, 14 db keksz 154 g",7622210977434,734.0,gin-183,https://imageproxy.wolt.com/assets/6a1403716fd1be614ec5f0cb
"OREO Original Klasszikus Vaníliaízű Töltött Keksz, Útközben is tökéletes, 4 db keksz 44 g",7622210411679,254.0,gin-183,https://imageproxy.wolt.com/assets/692845013c7e8f4c5cace62d
"OREO Original Vaníliaízű Töltött Keksz, vegetáriánusok is fogyaszthatják, 14 db keksz 154 g",7622210018922,734.0,gin-183,https://imageproxy.wolt.com/assets/6a0af3447263bae3427f7061
"OREO Original Vaníliaízű Töltött Keksz, vegetáriánusok is fogyaszthatják, 16 db keksz 176 g",7622300444181,809.0,gin-183,https://imageproxy.wolt.com/assets/692996496980ec1e3ff6411f
"Old Spice Cold Spice Férfi Izzadásgátló Géldezodor, 70 ml",8006530155557,1889.0,durum-teszta-291,https://imageproxy.wolt.com/assets/69380fa15ee143d2ef973c83
"Old Spice Cold Spice Férfi Izzadásgátló Spray, 150 ml",8006530101608,2309.0,gyogyteak-289,https://imageproxy.wolt.com/assets/692449574da254f4fa17588c
Olívás stangli,,150.0,laktozmentes-84,https://imageproxy.wolt.com/assets/69e329ed2aa2e1eb09807a16
Omlós tejkaramella 100 g,5999888021908,394.0,vodka-182,https://imageproxy.wolt.com/assets/689b9d5587a8f04a4a7dadee
"Oral-B Advanced Enamel Strengthening Clean Mint Fogkrém, 75 ml",8006530091008,1679.0,sutemeny-299,https://imageproxy.wolt.com/assets/699d935869f5f7b0b694aa75;https://imageproxy.wolt.com/assets/699d935869f5f7b0b694aa76
"Oral-B Complete Extra White Fogkrém Antibakteriális Cinkkel, {volumeLoc}] ml",8006530254779,789.0,sutemeny-299,https://imageproxy.wolt.com/assets/694bdd17d1c7b7ac494fbcc2
"Oral-B Pro-Expert Sensitive Fogkrém, 75 ml",8700216106818,839.0,sutemeny-299,https://imageproxy.wolt.com/assets/68943601b71c74e24e76f35b
Oreo Choc'o Brownie kakaós töltelékkel töltött kakaós keksz 154 g,7622210781727,734.0,gin-183,https://imageproxy.wolt.com/assets/6970c78b7e37809df6dec49a
Oreo Double Creme vanília ízű töltelékkel töltött kakaós keksz 157 g,7622210137258,734.0,gin-183,https://imageproxy.wolt.com/assets/6a019c964d71ffb5d4d4f098
Oreo Double Creme vanília ízű töltelékkel töltött kakaós keksz 170 g,7622210137234,809.0,gin-183,https://imageproxy.wolt.com/assets/692d8ad76980ec1e3ff65821
Oreo Remix vaníliaízű és málnaízű töltelékkel töltött kakaós keksz 157 g,7622201500702,734.0,gin-183,https://imageproxy.wolt.com/assets/6a0af33f7263bae3427f705b
Oreo Remix vaníliaízű és tiramisuízű töltelékkel töltött kakaós keksz 157 g,7622201388515,734.0,gin-183,https://imageproxy.wolt.com/assets/6a0af33f7263bae3427f705a
"Ovomia vegyes gyümölcs ízű, cukrozott pektin zselé 200 g",8585000201197,684.0,vodka-182,https://imageproxy.wolt.com/assets/6a2275e0657a078edc1b5a49;https://imageproxy.wolt.com/assets/6a2275e0657a078edc1b5a4a
PICK Rákóczi szeletelt nemespenészes csemege szalámi 80 g,5998003162670,839.0,chips-extrudalt-termekek-114,https://imageproxy.wolt.com/assets/689bb62487a8f04a4a7de274;https://imageproxy.wolt.com/assets/689bb62587a8f04a4a7de279
PICK Rákóczi szeletelt nemespenészes paprikás szalámi 80 g,5998003162687,839.0,chips-extrudalt-termekek-114,https://imageproxy.wolt.com/assets/689bb62487a8f04a4a7de273;https://imageproxy.wolt.com/assets/689bb62587a8f04a4a7de278
PICK szeletelt eredeti téliszalámi 70 g,5998003124104,944.0,chips-extrudalt-termekek-114,https://imageproxy.wolt.com/assets/689bb61f87a8f04a4a7de26e;https://imageproxy.wolt.com/assets/689bb620f18c6aaa8030d6d1
Paco bulgur 1 kg,5997975305986,985.0,antipasti-159,https://imageproxy.wolt.com/assets/689b86b787a8f04a4a7d9bda
Palermo paprika étkezési 400 g,,1699.0,virsli-62,https://wolt-menu-images-cdn.wolt.com/menu-images/6654467e27f761196caa9ef7/0e732712-79c5-11f0-a95b-b212e0caf2ea_501457006.png
Pamina Mini plusz inkontinencia betét 16 db,,1649.0,dobozos-gyumolcsle-306,https://imageproxy.wolt.com/assets/6a1ecadf3129ab097d01d62c
Pamina extra inkontinencia betét 12 db,,1104.0,dobozos-gyumolcsle-306,https://imageproxy.wolt.com/assets/6a1eca5210f246e5992b7bc3
