product_name,barcode,unit_price,categories,image_urls
"1664 Blanc világos búzasör 5% 0,5 l",8600331002487,605.0,alkoholmentes-sor-234,https://imageproxy.wolt.com/assets/68e7aafa76f0377a07cb985b
"1664 Blanc világos búzasör 5% 4 x 0,5 l (2 l)",8600331002968,2299.0,alkoholmentes-sor-234,https://imageproxy.wolt.com/assets/69c57490e24f4a9d75093bd7
"1x1 Vitaday Magnézium + B6-vitamin étrend-kiegészítő filmtabletta 30 db 10,35 g",,1059.0,halkonzerv-huskonzerv-melegszendvicskrem-152,https://wolt-menu-images-cdn.wolt.com/menu-images/66544565d6a91b4d1392d750/aa383b00-9ab4-11f0-abc8-5ab5c7d45ff3_sx339_1x1_magnezium_b6_vitamin_tabl.jpg
1x1 Vitamin C-vitamin 1000 mg narancsízű étrend-kiegészítő rágótabletta 60 x 1800 mg (108 g),5999883354667,3179.0,halkonzerv-huskonzerv-melegszendvicskrem-152,https://imageproxy.wolt.com/assets/692d8a756980ec1e3ff65756
1x1 Vitamin Multivitamin +cink & vas erdei gyümölcsös étrend-kiegészítő tabletta 60 db 60 g,5999883354933,1854.0,halkonzerv-huskonzerv-melegszendvicskrem-152,https://imageproxy.wolt.com/assets/692d8a736980ec1e3ff65752
1x1 Vitamin multivitamin narancs ízű étrend-kiegészítő rágótabletta 90 x 800 mg (72 g),5999561573236,1695.0,halkonzerv-huskonzerv-melegszendvicskrem-152,https://imageproxy.wolt.com/assets/692d8a756980ec1e3ff65758
7DAYS Bake Rolls bacon ízű kétszersült 80 g,5201360112265,539.0,feher-bor-190,https://imageproxy.wolt.com/assets/689b73909bbcfa1dc39bb0cc
7DAYS Bake Rolls pizza ízű kétszersült 80 g,5201360671069,539.0,feher-bor-190,https://imageproxy.wolt.com/assets/689b7393f18c6aaa8030949d
7DAYS Bake Rolls sós kétszersült 80 g,5201360639007,539.0,feher-bor-190,https://imageproxy.wolt.com/assets/689b73909bbcfa1dc39bb0cd
7DAYS Family Pack croissant kakaós töltelékkel 5 x 37 g (185 g),7622201393564,1079.0,mentes-termekek-82,https://imageproxy.wolt.com/assets/69bbe5c8016902d4a7a17f1c
7DAYS Oreo vanília krémes és kekszes croissant 60 g,7622202267406,324.0,mentes-termekek-82,https://imageproxy.wolt.com/assets/69873077df12ec2860944f9c
7DAYS mogyoró croissant 80 g,7622202378867,379.0,mentes-termekek-82,https://imageproxy.wolt.com/assets/6995aa916ddfd847c2c6c44b
Agárdi Miraculum Vilmoskörte pálinka 40% 500 ml,5999545372404,12754.0,szalami-242,https://imageproxy.wolt.com/assets/68e507f289477a351265c13f
Ajax Flower Fiesta Lagoon Flowers Türkiz általános tisztítószer 1000 ml,5900273472908,914.0,friss-gyumolcslevek-273,https://imageproxy.wolt.com/assets/69eb4d81cbbf5c0b40d4d5aa
Ajax Flower Fiesta Orgona virág Lila általános tisztítószer 1000 ml,5900273462213,914.0,friss-gyumolcslevek-273,https://imageproxy.wolt.com/assets/689bb4bb9bbcfa1dc39bed16
Ajax Flower Fiesta Pipacs Piros általános tisztítószer 1000 ml,5900273472984,914.0,friss-gyumolcslevek-273,https://imageproxy.wolt.com/assets/689bb4bdf18c6aaa8030d526
Ajax Flower Fiesta Tavaszi virágok Zöld általános tisztítószer 1000 ml,5900273472939,914.0,friss-gyumolcslevek-273,https://imageproxy.wolt.com/assets/689bb4bcf18c6aaa8030d524
Alkoholmentes bordó ajándékkosár,5998574302093,22049.0,cukormentes-257,https://imageproxy.wolt.com/assets/689bb1e987a8f04a4a7dd506;https://imageproxy.wolt.com/assets/689bb1e987a8f04a4a7dd509
"Alpro kókusz- és szójaital matcha teával, hozzáadott kalciummal, jóddal, B2-, B9- és D2-vitaminn 1 l",5411188142522,1354.0,kakao-77,https://imageproxy.wolt.com/assets/69e9fbd328419a6b3196cabd
"Alpro zsírszegény fermentált szójakészítmény datolyával, cseresznyével, eperrel 135 g",5411188136361,660.0,gumicukor-110,https://imageproxy.wolt.com/assets/667948395bc89c3fb6bf3de6
Alufix alufólia 20 m,5949509000058,1259.0,glutenmentes-276,https://imageproxy.wolt.com/assets/689b7daa9bbcfa1dc39bbbff
Alufix alufólia 30 m,5949509000072,1784.0,glutenmentes-276,https://imageproxy.wolt.com/assets/689b7daa9bbcfa1dc39bbc00
"Alufix sütőpapír lapokban, 20 lap",5949509002755,894.0,glutenmentes-276,https://imageproxy.wolt.com/assets/69775eb3abd519155b89285d
"Ambi Pur 3Volution Gold Orchid Elektromos Illatpárologtató-utántöltő, 20ml",8001841922690,2519.0,magvak-278,https://imageproxy.wolt.com/assets/68d14200bd5756f4002af3e3
Ambi Pur Fürdőszobai Légfrissítő - Folyamatos Szagsemlegesítés És Szagmegelőzés Cotton Fresh 1 X,8700216014434,2099.0,magvak-278,https://imageproxy.wolt.com/assets/68c2c185bd456827e99aba8f
Ambi Pur Légfrissítő Spray Gold Orchid 370 ml,8006530260541,2939.0,magvak-278,https://imageproxy.wolt.com/assets/692450117a24b1c086711635
Ambi Pur Légfrissítő Spray Japanese Blossom 185 ml,8006530394567,1889.0,natur-gorog-joghurt-279,https://imageproxy.wolt.com/assets/69b934537c28665a5e592562
Amodent Eredeti fogkrém 100 ml,8717644554555,474.0,sutemeny-299,https://imageproxy.wolt.com/assets/66793c2934063d58fe45f491;https://imageproxy.wolt.com/assets/66793d0e35e1b1789b04c5f8
Ananász db,,1039.0,kefir-aludttej-54,https://wolt-menu-images-cdn.wolt.com/menu-images/6654467e27f761196caa9ef7/831303b0-790e-11f0-834f-ce636a38a856_367210005.png
Aquafresh Big Teeth Mild Mint fluoridos fogkrém 50 ml,3830029291687,734.0,sutemeny-299,https://wolt-menu-images-cdn.wolt.com/menu-images/66544565d6a91b4d1392d750/64352a98-f36e-11ef-983f-f2bde3e3e3f6_wst_534627001.jpg
Arany körkosár,5998574302307,16324.0,cukormentes-257,https://imageproxy.wolt.com/assets/689bb1ea87a8f04a4a7dd50d;https://imageproxy.wolt.com/assets/689bb1eb87a8f04a4a7dd511
Atrix kézvédő kézkrém kamillával 100 ml,9005800374819,1524.0,levesbetet-292,https://imageproxy.wolt.com/assets/697b53d1088b76a80bd49b99;https://imageproxy.wolt.com/assets/697b53d1088b76a80bd49b98
Augusto Gulliver karamell ízű fagylalt sós karamell ízű szósszal és ostyadarával 120 ml,5907377117032,644.0,gin-183,https://imageproxy.wolt.com/assets/689b7cfe9bbcfa1dc39bba61;https://imageproxy.wolt.com/assets/689b7d009bbcfa1dc39bba62
Avokádó db,,624.0,kefir-aludttej-54,https://imageproxy.wolt.com/assets/689b8f74f18c6aaa8030b280
"BE(er) cool Premium Lager 0,33 l 5,0%",,290.0,izesitett-sor-233,https://wolt-menu-images-cdn.wolt.com/menu-images/66544565d6a91b4d1392d750/4f2a48e8-c07a-11f0-9cae-1a4f58fe13f9_full__96_.png
BIO áfonya 125 g,,1249.0,tejfol-52,https://wolt-menu-images-cdn.wolt.com/menu-images/66544565d6a91b4d1392d750/9bbe86c8-9dee-11f0-9c4a-468d290f26a6_512489003.png
Bahlsen Hit kakaós keksz 220 g,5901414203931,1324.0,gin-183,https://imageproxy.wolt.com/assets/697369f67e37809df6df159a
Ballantine's Finest skót whisky 40% 500 ml,5998829900715,5299.0,pekaru-241,https://imageproxy.wolt.com/assets/689b8f07f18c6aaa8030b1ad
Ballantine's Finest skót whisky 40% 700 ml,5998829900722,8974.0,pekaru-241,https://imageproxy.wolt.com/assets/689b8f07f18c6aaa8030b1ab
"Ballantine's Wild cseresznye ízesítésű skót whisky-ből készült szeszesital 30% 0,7 l",5998829900838,8974.0,pekaru-241,https://imageproxy.wolt.com/assets/689b8f089bbcfa1dc39bc82b
Barna nád kockacukor 500 g,9012501006550,494.0,levesek-tesztak-169,https://imageproxy.wolt.com/assets/689ba9db87a8f04a4a7dbea0;https://imageproxy.wolt.com/assets/689ba9dc87a8f04a4a7dbea4
Basic laskagomba 300 g,5999884574330,729.0,pastetomok-majasok-66,https://imageproxy.wolt.com/assets/689b9c6b87a8f04a4a7dad0b
"Beck's minőségi világos sör 5% 4 x 0,5 l",5998817532027,1984.0,alkoholmentes-sor-234,https://imageproxy.wolt.com/assets/69415102971a9b8089960815;https://imageproxy.wolt.com/assets/69415102971a9b8089960816
Belvita Soft Bakes Gabonás Keksz Epres Töltelékkel 50 G,7622210769947,314.0,gin-183,https://imageproxy.wolt.com/assets/6970c70e7e37809df6dec3b0
"Belvita Soft Bakes gabonás, mogyoróízű keksz kakaós töltelékkel 50 g",7622210788108,314.0,gin-183,https://imageproxy.wolt.com/assets/6a0af3427263bae3427f705e
"Belvita erdei gyümölcsös, gabonás keksz 6 x 50 g (300 g)",7622210346735,1259.0,gin-183,https://imageproxy.wolt.com/assets/69e669d4b5846925d4312461
"Belvita gabonás keksz, mogyorós ízű kakaós töltelékkel 250g",7622210833051,1259.0,gin-183,https://imageproxy.wolt.com/assets/698f1983960776714feee13f
"Belvita kakaós, gabonás keksz csokoládédarabokkal 30% kevesebb cukorral 6  50 g (300 g)",7622210728142,1259.0,gin-183,https://imageproxy.wolt.com/assets/69a97834f115f4a3251e8822
"Belvita kakaós, gabonás keksz csokoládédarabokkal 50g",7622300382216,314.0,gin-183,https://imageproxy.wolt.com/assets/69833c4d879d20d22ae7f1ce
"Belvita kakaós, gabonás keksz csokoládédarabokkal 6 x 50 g (300 g)",7622300443269,1259.0,gin-183,https://imageproxy.wolt.com/assets/6a01d4d030a310d3192f2778
"Belvita mogyorós és mézes, gabonás keksz csokoládédarabokkal 6 x 50 g (300 g)",7622210194961,1259.0,gin-183,https://imageproxy.wolt.com/assets/6970c73a7e37809df6dec3e6
"Bergen Baileys kakaós keksz krémes töltelékkel, tejcsokoládé bevonattal 128 g",5060250346759,1259.0,gin-183,https://imageproxy.wolt.com/assets/689bb5e0f18c6aaa8030d68a
Bergen eper ízű tejes krémmel töltött keksz matchás tejbevonattal 128 g,5902379795622,1259.0,gin-183,https://imageproxy.wolt.com/assets/69d54682f17312ee6578ea01
Bibigo Gyoza gyorsfagyasztott tofuval és zöldségekkel töltött gombócok 300 g,4016337960098,2544.0,kakao-77,https://imageproxy.wolt.com/assets/69132d2fe9eb908bf84ef8c1;https://imageproxy.wolt.com/assets/69132d2fe9eb908bf84ef8c0
Bibigo gyorsfagyasztott csirkével és zöldségekkel töltött gombóc 300 g,4016337960074,2544.0,gyumolcsbor-193,https://imageproxy.wolt.com/assets/69147e4f43a2bd3cfbf46172;https://imageproxy.wolt.com/assets/69147e4f43a2bd3cfbf46171
Bibigo gyorsfagyasztott marhahússal és zöldségekkel töltött gombócok 300 g,4016337911472,2544.0,gyumolcsbor-193,https://imageproxy.wolt.com/assets/69132d30e9eb908bf84ef8c3;https://imageproxy.wolt.com/assets/69132d30e9eb908bf84ef8c2
Bio retekcsíra 60 g,5999881012026,964.0,kave-tea-kakao-74,https://imageproxy.wolt.com/assets/689b9bc3f18c6aaa8030c33d
BioTechUSA Calcium Zinc Magnesium étrendkiegészítő tabletta ásványi anyagokkal 147 g,5999076251827,4239.0,halkonzerv-huskonzerv-melegszendvicskrem-152,https://imageproxy.wolt.com/assets/689b944e9bbcfa1dc39bcae8;https://imageproxy.wolt.com/assets/689b944f9bbcfa1dc39bcaed
BioTechUSA Energy Gel narancs ízű étrendkiegészítő gél 40 g,5999076250998,755.0,halkonzerv-huskonzerv-melegszendvicskrem-152,https://imageproxy.wolt.com/assets/689b944b87a8f04a4a7da890;https://imageproxy.wolt.com/assets/689b944c87a8f04a4a7da895
BioTechUSA Energy Shot citrom ízű komplex szénhidrát tartalmú folyékony készítmény 25 ml,,744.0,halkonzerv-huskonzerv-melegszendvicskrem-152,https://wolt-menu-images-cdn.wolt.com/menu-images/66544565d6a91b4d1392d750/03eaf444-9ab5-11f0-b8c6-1a3997a068a7_sx330_energy_shot_25ml.jpg
Bismarck fánk,,269.0,dinnyek-9,https://wolt-menu-images-cdn.wolt.com/menu-images/66544565d6a91b4d1392d750/e4e38f4a-f606-11f0-8fa1-7a18dd2e1657_177761.jpg;https://wolt-menu-images-cdn.wolt.com/menu-images/66544565d6a91b4d1392d750/0ad9d298-6e05-11f0-b28c-3afe9abc2338_552409009.jpg
"Black Velvet kanadai whisky 40% 0,7 l",5995099443843,6979.0,pekaru-241,https://imageproxy.wolt.com/assets/699853ee69f5f7b0b6947c61
"Blend-a-dent Complete Original Műfogsorragasztó Krém, 2x47 g",8006540300053,3044.0,sutemeny-299,https://imageproxy.wolt.com/assets/68c4134b2c60b119670effd8
"Blend-a-dent Complete Original Műfogsorrögzítő Krém, 47 g",8001841900483,2059.0,sutemeny-299,https://imageproxy.wolt.com/assets/68d141adbd5756f4002af35e;https://imageproxy.wolt.com/assets/68d141adbd5756f4002af35d
Bogyós mix 650 g,,4679.0,tejfol-52,https://wolt-menu-images-cdn.wolt.com/menu-images/66544565d6a91b4d1392d750/82f71812-ea42-11f0-af3f-5a6f05802026_530654001.png
Bombi kakaós bevonómasszába mártott puszedli vegyes gyümölcsös-szilvás töltelékkel 50 g,8584004305863,335.0,palinka-180,https://imageproxy.wolt.com/assets/69fa6a5c9c4fe0d3ac5032f6;https://imageproxy.wolt.com/assets/69fa6a5c9c4fe0d3ac5032f5
"Bombi kakaós bevonómasszába mártott, sárgabarackos lekvárral töltött puszedli 50 g",8584004305856,335.0,palinka-180,https://imageproxy.wolt.com/assets/69fa6a5b9c4fe0d3ac5032f3;https://imageproxy.wolt.com/assets/69fa6a5b9c4fe0d3ac5032f4
Bonbonetti Dunakavics pörkölt földimogyorós cukordrazsé 70 g,4823077639029,429.0,vodka-182,https://imageproxy.wolt.com/assets/689b7158f18c6aaa80309141;https://imageproxy.wolt.com/assets/689b7159f18c6aaa80309145
Bonbonetti Franciadrazsé kakaós cukordrazsé 70 g,4823077639043,429.0,vodka-182,https://imageproxy.wolt.com/assets/689b6ddaf18c6aaa80308e2a;https://imageproxy.wolt.com/assets/689b6ddbf18c6aaa80308e2f
Brado Life Aloe Vera kézfertőtlenítő gél 50 ml,5997001770726,409.0,friss-gyumolcslevek-273,https://imageproxy.wolt.com/assets/689b80169bbcfa1dc39bc08a
Bref Brilliant Gel Artic Ocean WC frissítő 2 x 42 g,9000101508727,1784.0,glutenmentes-termekek-275,https://imageproxy.wolt.com/assets/68d1452e96bcfcad1bd5da98
Bref Brilliant Gel Artic Ocean WC frissítő 3 x 42 g,9000101508123,2489.0,glutenmentes-termekek-275,https://imageproxy.wolt.com/assets/68d1452e96bcfcad1bd5da97
Bref Color Auto Active Eucalyptus WC-frissítő 2 x 50 g,9000101852455,1784.0,glutenmentes-termekek-275,https://imageproxy.wolt.com/assets/69d4e3ef081970206946f139
Bref Color Auto Active Eucalyptus WC-frissítő 3 x 50 g,9000101853261,2489.0,glutenmentes-termekek-275,https://imageproxy.wolt.com/assets/69d4e3f0081970206946f13a
Bref Color Auto Active Flower WC frissítő 2 x 50 g,9000101850758,1784.0,glutenmentes-termekek-275,https://imageproxy.wolt.com/assets/69d4e3f5081970206946f13f
Bref Color Auto Active Flower WC-frissítő 3 x 50 g,9000101853384,2489.0,glutenmentes-termekek-275,https://imageproxy.wolt.com/assets/69d4e3f6081970206946f140
Bref Power Active Lavender WC frissítő 3 x 50 g,9000100956192,2164.0,glutenmentes-termekek-275,https://imageproxy.wolt.com/assets/69f0936258508b10d47b11db
Bref Power Active Lemon WC frissítő 3 x 50 g,9000100753371,2164.0,glutenmentes-termekek-275,https://imageproxy.wolt.com/assets/69f0936058508b10d47b11d8
Bref Power Active Ocean WC frissítő 2 x 50 g,9000100656863,1629.0,glutenmentes-termekek-275,https://imageproxy.wolt.com/assets/69f0936358508b10d47b11dc
Bref Power Aktiv Gel Lemon WC tisztítószer 700 ml,9000101312133,944.0,glutenmentes-termekek-275,https://imageproxy.wolt.com/assets/68d144d796bcfcad1bd5d9c7
Bref Power Aktiv Gel Ocean WC tisztítószer 700 ml,9000101311570,944.0,glutenmentes-termekek-275,https://imageproxy.wolt.com/assets/68d1456396bcfcad1bd5db1b
Bref Power Aktiv Lemon WC frissítő 2 x 50 g,9000100656832,1629.0,glutenmentes-termekek-275,https://imageproxy.wolt.com/assets/694546133f31751f2f339ce4
Bref Spa Moments Harmony WC frissítő 2 x 50 g,9000101587722,1784.0,glutenmentes-termekek-275,https://imageproxy.wolt.com/assets/68d1452d96bcfcad1bd5da94
"Bulleit Kentucky Straight amerikai (US) Bourbon Whiskey 45% 0,7 l",5995099737287,17584.0,pekaru-241,https://imageproxy.wolt.com/assets/689b7e3f9bbcfa1dc39bbd61
"Béres C-vitamin 1000 mg + 1000 NE D₃-vitamin filmtabletta csipkebogyó kivonattal 50 x 1,38 g",5997207710021,2864.0,halkonzerv-huskonzerv-melegszendvicskrem-152,https://imageproxy.wolt.com/assets/69317f75c5cb6de83d0d47a0;https://imageproxy.wolt.com/assets/69317f75c5cb6de83d0d479e
"Béres Magnézium Forte filmtabletta 50 db 62,5 g",5997207713541,3564.0,halkonzerv-huskonzerv-melegszendvicskrem-152,https://imageproxy.wolt.com/assets/69f2e407c0846bd69f90a0ce;https://imageproxy.wolt.com/assets/69f2e407c0846bd69f90a0cd
"Béres Magnézium Komplex filmtabletta 50 db 61,8 g",5997207715446,2514.0,halkonzerv-huskonzerv-melegszendvicskrem-152,https://imageproxy.wolt.com/assets/69f2e40bc0846bd69f90a0da;https://imageproxy.wolt.com/assets/69f2e40ac0846bd69f90a0d9
"Béres Mg+B6 filmtabletta, magnéziumot és B6-vitamint tartalmazó étrend-kiegészítő 10 x 12,5 g",5997207711561,550.0,halkonzerv-huskonzerv-melegszendvicskrem-152,https://imageproxy.wolt.com/assets/689bafdb87a8f04a4a7dce85
"Cafe Frei pisztácia ízesítésű pörkölt, őrölt kávékeverék 200 g",5999861070381,2099.0,vizek-uditok-136,https://imageproxy.wolt.com/assets/69c1800c8b41e83846b01d35
Carefree Plus Large tisztasági betét aloe vera illattal 48 db,3574660709216,1679.0,dobozos-gyumolcsle-306,https://imageproxy.wolt.com/assets/68d5370235cd665795fd4971
"Carlsberg világos sör 5% 4 x 0,5 l",8600331002975,2089.0,alkoholmentes-sor-234,https://imageproxy.wolt.com/assets/69a5830cdbcc2d14e2ced56a
"Cerbona matcha-vanília ízű zabkása, cukor hozzáadása nélkül, édesítőszerekkel 50 g",5998400316379,314.0,pizzak-131,https://imageproxy.wolt.com/assets/69f1f4ae126eb988a893010f
Ceres Napicipó teljes kiőrlésű kenyér 400 g,5998703533480,755.0,mez-80,https://imageproxy.wolt.com/assets/689bae7a87a8f04a4a7dca0c;https://imageproxy.wolt.com/assets/689bae7b87a8f04a4a7dca0f
Cheetos Spirals sajtos és ketchupos ízesítésű kukoricasnack 30 g,5900259087164,459.0,rum-188,https://imageproxy.wolt.com/assets/6a045bb8c640c042bb9ed6a2
Chewits Xtreme Sour olvadó rágó 115 g,5060072652250,1324.0,vodka-182,https://imageproxy.wolt.com/assets/689b767687a8f04a4a7d8000
Chio Brezli Original sósperec 200 g,5997312706018,1059.0,feher-bor-190,https://imageproxy.wolt.com/assets/689bb33e87a8f04a4a7dd987
Chio Brezli Original sósperec 80 g,4000522060311,615.0,feher-bor-190,https://imageproxy.wolt.com/assets/689bb1f387a8f04a4a7dd530
Chio Crackings Original sós kréker 100 g,4000522060731,649.0,feher-bor-190,https://imageproxy.wolt.com/assets/689bb34087a8f04a4a7dd98f
"Chio Hula Hoops kukoricalisztből készült snack, sajtos ízű 70 g",5941445678025,539.0,rum-188,https://imageproxy.wolt.com/assets/697ca4745f911384730fbd88
"Chio Hula Hoops mézes, barbecue szósz ízű kukoricalisztből készült snack 70 g",5941445678032,539.0,rum-188,https://imageproxy.wolt.com/assets/697ca4755f911384730fbd89
Chio Maxi Mix kréker és sósperec keverék 100 g,4000522060915,690.0,feher-bor-190,https://imageproxy.wolt.com/assets/689bb34087a8f04a4a7dd992
Chio Maxi Mix sós kréker keverék 225 g,5996253002852,1189.0,feher-bor-190,https://imageproxy.wolt.com/assets/69dccd2baf51c9ef775316c6
Chio Party Mix sós kréker keverék 200 g,4000522060519,1059.0,feher-bor-190,https://imageproxy.wolt.com/assets/689bb3419bbcfa1dc39beb56
Chio Stickletti Original sós pálcika 100 g,4000522061752,615.0,feher-bor-190,https://imageproxy.wolt.com/assets/689bb33f87a8f04a4a7dd98c
Chio Stickletti Original sós pálcika 2 x 100 g,4000522061691,1059.0,feher-bor-190,https://imageproxy.wolt.com/assets/689bb33f87a8f04a4a7dd98b
Chio Stickletti burgonyás pálcika 80 g,5996253000452,539.0,feher-bor-190,https://imageproxy.wolt.com/assets/689bb33f87a8f04a4a7dd989
Chio Stickletti hagymás-tejfölös pálcika 80 g,5996253000476,615.0,feher-bor-190,https://imageproxy.wolt.com/assets/689bb34087a8f04a4a7dd98e
Chio Stickletti sajtos pálcika 80 g,5996253000469,539.0,feher-bor-190,https://imageproxy.wolt.com/assets/689bb34087a8f04a4a7dd990
Chio Stixi ketchupos ízű burgonyachips 120 g,5996253002869,1025.0,rum-188,https://imageproxy.wolt.com/assets/697ca4765f911384730fbd8b
Chio sonkás és sajtos ízű pattogatott kukorica 75 g,8595606209411,649.0,borok-189,https://imageproxy.wolt.com/assets/68e5080389477a351265c15c
"Chivas Regal 12YO skót whisky 40% 0,7 l",5998829902276,12544.0,pekaru-241,https://imageproxy.wolt.com/assets/689b8f0df18c6aaa8030b1bc
Chivers Olde English hagyományos angol narancsmarmelád 340 g,5098732004835,749.0,energiaital-142,https://imageproxy.wolt.com/assets/689b72d6f18c6aaa803093d3;https://imageproxy.wolt.com/assets/689b72d7f18c6aaa803093d7
Chupa Chups Melody Pops eper ízű nyalóka 15 g,8935001728016,299.0,vodka-182,https://imageproxy.wolt.com/assets/68a6c673c36a14b1703147d6;https://imageproxy.wolt.com/assets/68a6c674c36a14b1703147d8
Chupa Chups The Best Of nyalóka több ízben 12 g,49814521,275.0,vodka-182,https://imageproxy.wolt.com/assets/69f30dfc126eb988a8930748;https://imageproxy.wolt.com/assets/69f30dfc126eb988a8930749
Chupa Chups nyalóka rágógumi töltelékkel 29 g,84460554,539.0,vodka-182,https://imageproxy.wolt.com/assets/678e0e414b2b7137a212e43b
Cif Cleanboost Cream Original súrolókrém 500 ml,8712561552905,1344.0,cukrasz-termekek-274,https://imageproxy.wolt.com/assets/69e17910609eafedc63bc5da
Cillit Bang Expert Fürdőszobai Ragyogás spray 750 ml,5900627081152,1679.0,glutenmentes-termekek-275,https://imageproxy.wolt.com/assets/689b7b389bbcfa1dc39bb6ce;https://imageproxy.wolt.com/assets/689b7b3a9bbcfa1dc39bb6d3
"Cillit Bang Expert fürdőszobai vízkőoldó spray, 750 ml",5997321740690,1679.0,glutenmentes-termekek-275,https://imageproxy.wolt.com/assets/689bb0d087a8f04a4a7dd193;https://imageproxy.wolt.com/assets/689bb0d087a8f04a4a7dd196
Classic gyorsfagyasztott trópusi gyümölcs mix 250 g,5999548674048,1559.0,boralapu-italok-sherry-egyeb-szeszezett-bor-194,https://imageproxy.wolt.com/assets/697218753c4317679c57f653;https://imageproxy.wolt.com/assets/697218753c4317679c57f652
Coca-Cola és Jack Daniel's Tenessee Whiskey alkoholos szénsavas üdítőital 5% 330 ml,5993330003443,1099.0,pekaru-241,https://imageproxy.wolt.com/assets/6a2302ed6daab3e35af06627
Colgate Max Fresh Cooling Crystals fogkrém 75ml,8718951313255,734.0,sutemeny-299,https://imageproxy.wolt.com/assets/69205c3e06e04050fa7f5fce;https://imageproxy.wolt.com/assets/69205c3e06e04050fa7f5fcd
Colgate Max White Sparkle Diamonds fogfehérítő fogkrém 75 ml,8718951314795,734.0,sutemeny-299,https://imageproxy.wolt.com/assets/680a548d9392d88b9bf90462;https://imageproxy.wolt.com/assets/680a548e9392d88b9bf90468
Colgate Total Whitening fogfehérítő fogkrém 75 ml,8718951226807,944.0,sutemeny-299,https://imageproxy.wolt.com/assets/6989cc999b8bf6759953b37c;https://imageproxy.wolt.com/assets/69f1bc78126eb988a892ffbb
Colgate Whitening fogfehérítő fogkrém 75 ml,6920354836091,419.0,sutemeny-299,https://imageproxy.wolt.com/assets/689bb49a87a8f04a4a7dde67;https://imageproxy.wolt.com/assets/689bb49a87a8f04a4a7dde6d
"Connemara ír whiskey 40% 0,7 l",5999139001079,19054.0,pekaru-241,https://imageproxy.wolt.com/assets/689b95baf18c6aaa8030b977
Corega Fogínyvédő műfogsorrögzítő krém 40 g,5054563014412,1839.0,sutemeny-299,https://imageproxy.wolt.com/assets/689b79ec9bbcfa1dc39bb475
"Cornexi epres vaníliaízű instant zabkása hozzáadott cukor nélkül, édesítőszerrel 55 g",5998038318738,259.0,pizzak-131,https://imageproxy.wolt.com/assets/699d9a0069f5f7b0b694aaa9
Csabai csemege szárazkolbász 250 g,5998001793975,1994.0,baromfi-119,https://imageproxy.wolt.com/assets/69678ca433f5684139c969d2;https://imageproxy.wolt.com/assets/69678ca433f5684139c969d3
Családi ajándékkosár,5998574302161,37899.0,cukormentes-257,https://imageproxy.wolt.com/assets/689bb1ed87a8f04a4a7dd519;https://imageproxy.wolt.com/assets/689bb1ed87a8f04a4a7dd51b
Csipet Ropi 80 g,5997424311414,340.0,feher-bor-190,https://imageproxy.wolt.com/assets/689b840a87a8f04a4a7d9645
Csoda Konyha Carbonara mártás alappor 26 g,5997359136588,345.0,vilagos-sor-231,https://imageproxy.wolt.com/assets/689b830e87a8f04a4a7d942b
Csoda Konyha bolognai mártás alappor 47 g,5997359136557,345.0,vilagos-sor-231,https://imageproxy.wolt.com/assets/689b830e87a8f04a4a7d9427
Csoda Konyha mexikói chilis bab alappor 45 g,5997359136571,345.0,vilagos-sor-231,https://imageproxy.wolt.com/assets/689b830e87a8f04a4a7d942a
Csoda Konyha milánói mártás alappor 48 g,5997359136564,345.0,vilagos-sor-231,https://imageproxy.wolt.com/assets/689b830e87a8f04a4a7d9428
Csokoládé ízű gyűrűs fánk,,174.0,dinnyek-9,https://wolt-menu-images-cdn.wolt.com/menu-images/66544565d6a91b4d1392d750/e0451e00-f60a-11f0-9d7d-1631d6269087_177257.jpg
Csomagolt hegyes erős paprika 500 g,,747.0,virsli-62,https://imageproxy.wolt.com/assets/6a0585672d649b967827ae43
Csíki Csipsz szarvasgombás ízesítésű pattogatott kukorica 40 g,5941904702360,539.0,borok-189,https://imageproxy.wolt.com/assets/689b7d829bbcfa1dc39bbb9b;https://imageproxy.wolt.com/assets/689b7d839bbcfa1dc39bbb9f
Czelli Malom omlós pogácsa lisztkeverék 1 kg,5997570500045,1379.0,enjoy-termekek-160,https://imageproxy.wolt.com/assets/689bb09587a8f04a4a7dd0c9
Czelli Malom vidéki kenyér lisztkeverék 1 kg,5997570500014,1165.0,enjoy-termekek-160,https://imageproxy.wolt.com/assets/6a1965975a2aca63c5597e51
DESPAR PREMIUM Salsiccia olasz húskészítmény 300 g,5999139401664,2099.0,baromfi-119,https://imageproxy.wolt.com/assets/689b95f99bbcfa1dc39bcc7f;https://imageproxy.wolt.com/assets/689b95fa9bbcfa1dc39bcc85
DESPAR Pinsa elősütött búzalisztből készült lepény durumbúzadarával és extraszűz olívaolajjal 230 g,9100000042619,1079.0,glutenmentes-85,https://imageproxy.wolt.com/assets/689baa5687a8f04a4a7dbf8a;https://imageproxy.wolt.com/assets/689baa5787a8f04a4a7dbf8f
DESPAR szarvasgombás majonéz 180 g,8001300244387,1364.0,tapszerek-224,https://imageproxy.wolt.com/assets/689bb11e9bbcfa1dc39bea29;https://imageproxy.wolt.com/assets/689bb11f9bbcfa1dc39bea2d
DOMESTOS Extended Power fertőtlenítő hatású folyékony tisztítószer Atlantic Fresh 750 ml,8717163286975,1164.0,friss-gyumolcslevek-273,https://imageproxy.wolt.com/assets/69e17ab7609eafedc63bc6f9
DOMESTOS Extended Power fertőtlenítő hatású folyékony tisztítószer Citrus Fresh 750 ml,5996037079780,1164.0,friss-gyumolcslevek-273,https://imageproxy.wolt.com/assets/69e17ab7609eafedc63bc6fa
DOMESTOS Extended Power fertőtlenítő hatású folyékony tisztítószer Pine Fresh 750 ml,5996037079797,1164.0,friss-gyumolcslevek-273,https://imageproxy.wolt.com/assets/69e17ab8609eafedc63bc6fb
"Danone Actimel zsírszegény, élőflórás, erdei gyümölcsízű joghurtalapú ital 8 x 100 g (800 g)",5997536303727,1619.0,cukorkak-drazsek-108,https://imageproxy.wolt.com/assets/689b8532f18c6aaa8030a13d;https://imageproxy.wolt.com/assets/689b8533f18c6aaa8030a142
